title,description,creator,source,publisher,date,contributor,language,rights,relation,format,type1,identifier,coverage,zotero_genre,zotero_distributor,zotero_director,z_performer,zotero_episode_number,zotero_language,zotero_network,zotero_audio_recording_format,zotero_label,zotero_running_time,zotero_num_pages,zotero_place,zotero_publisher,zotero_issn,zotero_isbn,zotero_issue,zotero_publication_title,z_url,zotero_volume,zotero_short_title,z_ref,type2,files,tags,collection
Greetings from Aroostook: Postcard DVD,"From Crown of Maine Productions: ""'Greetings From Aroostook' is a seventeen minute DVD featuring spectacular scenery, people and wildlife of The County set to music. The DVD includes scenes throughout the area from the Million Dollar View south of Houlton to Ramsey Ledge in The Allagash. It's narrated by Layne Longfellow, relative of the poet. It includes activities from different seasons of the year from skiing and snowmobiling to hiking and kayaking. Various cultural events are included from the Acadian Festival in The Valley to the Midsommar Festival in New Sweden, and, of course, Fort Fairfield's Potato Blossom Festival. It even has a scene of youngsters picking potatoes at harvest time. It's a wonderful reminder of life in The County - 'The Way Maine Used To Be,' as some say. And it's a great gift idea for friends and family who live outside the area to give them a taste of home, or to entice them to visit.""","Jepson, Brenda N. (director)",Watch: PREVIEW,,2006,"Longfellow, Layne (narrator)",English,,,,Film,"<a href=""http://www.worldcat.org/oclc/76891153"">76891153</a>","2006; Aroostook County, Maine",Documentary,Crown of Maine Productions,,,,English,,,,00:17:00,,,,,,,,"<div class=""element-text""><a href=""http://www.crownofmaineproductions.com/ArooGreetDVD.html"">http://www.crownofmaineproductions.com/ArooGreetDVD.html</a></div>",,,,,https://francolibrary.com/archive/files/cb9fcb311812bf7c25cd8c7d1a606b79.jpg,Acadians;Aroostook County ME;Community: Customs and Social Life;Emigration and Immigration;Ethnicity and Collective Identity;Labor History;Native Americans,Audio & Video
"The Story of the Acadians: A Tale of Discovery, Tragedy, and Determination","From Crown of Maine Productions: ""'The Story of the Acadians' is a tale of discovery, tragedy and determination  of a peace loving people who never give up. Learn how the first French settlers brought with them pre-fabricated homes from France to North America in 1604, hear about their strong relations with the native people whose alliances helped to save their lives, witness the innovative designs of the French in the construction of the unique fortresses they built, as well as the intricate system of dykes they introduced into North America....Most of all, learn how the French became Acadians with a culture of their own  a culture of family values, of hard work and of a determination never to be destroyed despite numerous attacks by the British  assaults which culminated in one of the worst human tragedies of all time  the Deportation from Nova Scotia.""","Jepson, Brenda N. (director)",Watch: PREVIEW,,2006 (?),"Cyr, Don (featured historian);Duncan, William (illustrator);Longfellow, Layne (narrator)",English,,,,Film,"<a href=""http://www.worldcat.org/oclc/71009361"">71009361</a>","1604-2000, Canada, France, United States",Documentary,Crown of Maine Productions,,,,,,,,,,,,,,,,"<div class=""element-text""><a href=""http://www.crownofmaineproductions.com/storyacadian.html"">http://www.crownofmaineproductions.com/storyacadian.html</a></div>",,,,,https://francolibrary.com/archive/files/4bc5ec363acc43ba335b0f5dd927e4a9.jpg,Acadians;Death and Disaster;Ethnicity and Collective Identity;France;Great Britain;Language and Linguistics;Nova Scotia;Religion;United States;Violence,Audio & Video
Acadian Festival: Celebrate the St. John Valley's French Acadian Heritage,"From Crown of Maine Productions: ""'Acadian Festival' is a lively, one-hour show that features the French of the St John Valley, Maine, celebrating their Acadian history  from a re-enactment of the arrival of the Acadians in 1785 to fascinating demonstrations of Acadian traditions that could be taken straight from the pages of 'Evangeline.'...Music, dance, food, spinning, weaving, basket and snowshoe making are just a few of the Treasures of the Valley featured in this film.""","Jepson, Brenda N. (director)",Watch: PREVIEW,,2003,,"English, with some French",,,,Film,"<a href=""http://www.worldcat.org/oclc/62585434"">62585434</a>","20th century, St. John River Valley, Maine",Documentary,Crown of Maine Productions,,,,,,,,0.041666667,,,,,,,,"<div class=""element-text""><a href=""http://www.crownofmaineproductions.com/festival.html"">http://www.crownofmaineproductions.com/festival.html</a></div>",,,,,https://francolibrary.com/archive/files/6c219487b619f6a8d288fb9171ec245e.jpg,Acadians;Community: Customs and Social Life;Maine;Music;St. John River Valley,Audio & Video
The Franco-American Dimension: New Hampshire,Film on the history of Franco-Americans in the state of New Hampshire. A series of photographs and paintings with descriptive narration.,"Eaton, Aurore Dionne",,,1991,"Marchand, Robert (narrator)",English,,,,Film,"<a href=""http://www.worldcat.org/oclc/74823189"">74823189</a>","20th century, New Hampshire",Documentary,Association Canado-Américaine,,,,English,,,,00:27:00,,,,,,,,,,,,,,Community: Customs and Social Life;Emigration and Immigration;Ethnicity and Collective Identity;New Hampshire,Audio & Video
Le Grand Jack,"Part-fiction documentary on the life and works of Jack Kerouac, a writer from Lowell, Massachusetts, most famous for his Beat Generation novel, ""On the Road."" Pris de l'ONF: ""Docufiction sur Jack Kerouac, un des membres les plus importants du mouvement de la Beat Generation.  Sur la route , une de ses œuvres les plus connues a rendu l'écrivain et poiète américain célièbre apriès sa mort en 1969. Ses textes ont grandement contribué à  la révolution culturelle, sexuelle et sociale des années 1960. Archives, photos, entrevues et reconstitution d'époque, servent de trame au réalisateur pour décortiquer le mythe du héros.""","Chiasson, Herménégilde",Watch/Regarder: FILM,,1987,"Nadon, Guy;Rudder, Michael",Français,,,,Film,"<a href=""http://www.worldcat.org/oclc/40932967"">40932967</a>",20e siiècle; Etats-Unis,Documentary,Office national du film du Canada,,,,,,,,00:54:39,,,,,,,,"<div class=""element-text""><a href=""http://www.onf.ca/film/grand_jack/"">http://www.onf.ca/film/grand_jack/</a></div>",,,,,https://francolibrary.com/archive/files/2a5513c20a19482bac02358f8d500161.jpg,Fiction and Literature;Film and Television;Lowell MA;New York NY;Personal History: Biography and Oral History;Québec;San Francisco CA,Audio & Video
Si je comprends bien... (If I Really Understand...),"A documentary that captures sentiments toward francophone cultures between France, Quebec, and New England in the context of Quebec's 1980 sovereignty referendum. From WorldCat: ""Features interviews with French Canadians and Franco-Americans about the importance of keeping the French language alive in New England and how Franco-Americans are in danger of losing their identity if they do not.""","Levine, Ben (director)",,,1980,,English and français,,,,Film,"<a href=""http://www.worldcat.org/oclc/56624171"">56624171</a>","1980, New England, Quebec",Documentary,Ben Levine Television,,,,English and français,,,,50 min.,,,,,,,,,,,,,,Acculturation and Assimilation;Ethnicity and Collective Identity;Government and Politics;Language and Linguistics;Lewiston ME;Maine;New England;Québec,Audio & Video
Maine Watch with Jennifer Rooks: Franco-Americans in Photos,"Maine Public Broadcasting Network television show focusing on news, events, and people important to the state of Maine. Here, part two of a three-part episode. ""Franco-Americans in Photos"" is an interview with journalist Dyke Hendrickson, author of the book ""Quiet Presence"" (1980), on his more recent publication entitled ""Franco-Americans of Maine,"" a cultural photo history.
","Austin, Mark D. (director)",,,2010 June 24,"Rooks, Jennifer (host)",English,,,,TV Broadcast,,"20th century, Maine",,,,,,,MPBN,,,00:27:28,,"Portland, Maine",,,,,,"<div class=""element-text""><a href=""http://video.mpbn.net/video/1531284767/"">http://video.mpbn.net/video/1531284767/</a></div>",,,,,https://francolibrary.com/archive/files/7ad1c715a639664b5e6f15f173cf432a.jpg,Biddeford ME;Ethnicity and Collective Identity;Lewiston ME;Madawaska ME;Maine;Personal History: Biography and Oral History;Raymond ME;Religion;Waterville ME,Audio & Video
Roughing the Uppers : The Great Shoe Strike of 1937,"From the Lewiston Sun Journal: ""The documentary tells the story of a strike that involved thousands of shoe workers and more than a dozen factories in Lewiston and Auburn [Maine]. Seeking higher wages and recognition of their union affiliation with the newly formed Congress of Industrial Organizations, the largely Franco-American workers called for a strike on March 24, 1937, during a mass meeting at Lewiston's city hall.""","Branham, Robert J. ;Francoeur, Lynn ;Surkis, William D. ",,,1992,,English,,,,Film,"<a href=""http://www.worldcat.org/oclc/28185042"">28185042</a>",,Documentary,,,,,,,,,00:55:00,,,,,,,,"<div class=""element-text""><a href=""http://oldfilm.org/content/roughing-uppers-great-shoe-strike-1937"">http://oldfilm.org/content/roughing-uppers-great-shoe-strike-1937</a> <br/><br/> <a href=""http://news.google.com/newspapers?nid=1914&amp;dat=19931108&amp;id=JGAgAAAAIBAJ&amp;sjid=pWUFAAAAIBAJ&amp;pg=1170,1589856"">http://news.google.com/newspapers?nid=1914&amp;dat=19931108&amp;id=JGAgAAAAIBAJ&amp;sjid=pWUFAAAAIBAJ&amp;pg=1170,1589856</a></div>",,,,,,Auburn ME;Death and Disaster;Film and Television;Labor History;Lewiston ME;Mills and Mill Work;Personal History: Biography and Oral History;Social History;Violence,Audio & Video
"ZONE LIBRE: Les Franco-Américains
du Maine","Du Radio-Canada: ""[Ici] Jean-Michel Leprince et Pierre Devroede ont rencontré des Franco-Américains de la communauté de Waterville, dans le Maine, qui réapprennent à  parler français.""","Leprince, Jean-Michel;Devroede, Pierre",,,2001 septembre 7,,Français,,,,Audio,,,,,,,,Français,,,,,,"Waterville, Maine",,,,,,"<div class=""element-text""><a href=""http://www.radio-canada.ca/actualite/zonelibre/01-09/franco.html"">http://www.radio-canada.ca/actualite/zonelibre/01-09/franco.html</a></div>",,,,,https://francolibrary.com/archive/files/816497246f1226fce6be61f58f289b43.gif,Death and Disaster;Emigration and Immigration;Family;Language and Linguistics;New England;Québec;Waterville ME,Audio & Video
Réveil...Waking Up French,"Documentary film about Franco American culture and language in New England. Press release from Watching Place Productions: ""Explores the struggle for cultural survival among the French-Canadian, Franco-American communities of New England. It reveals the importance of history and heritage understanding and demonstrates how languages can be reacquired for personal and community renewal.""","Levine, Ben (director)",,,2003,,"English, with some français",,,,Moving Image,"<a href=""http://www.worldcat.org/oclc/64637065"">64637065</a>","20th century, New England",Documentary,Watching Place Productions,,,,,,,,,,,,,,,,"<div class=""element-text""><a href=""http://www.wakingupfrench.com"">http://www.wakingupfrench.com</a></div>",,,,,https://francolibrary.com/archive/files/011b419d61c832b15e5b8f32deec0083.jpg,Acculturation and Assimilation;Augusta ME;Community: Customs and Social Life;Ethnicity and Collective Identity;La Beauce QC;Language and Linguistics;Lewiston ME;Madawaska ME;Music;Religion;Social History;Waterville ME;Woonsocket RI;Youth,Audio & Video
John Dufresne's Requiem Mass,"Georgia Public Broadcasting radio interview of Worcester, Massachusetts native John Dufresne on the occasion of his new novel, ""Requiem, Mass."" Discussion about the novel's characters and setting, Dufresne's ideas about autobiographical writing and writing in general, as well as some aspects of the author's Catholicism. At the end of the interview, Dufresne reads a passage from the novel (p. 168).","Freeman, Jesse (interviewer)",Listen: PODCAST,,2009 January 23,"Dufresne, John",English,,,Streaming audio,Audio Recording,"<a href=""http://www.worldcat.org/oclc/181139334"">181139334</a>",,,,,,,,,Mp3,,00:29:00,,Georgia,,,,,,"<div class=""element-text""><a href=""http://covertocover.podbean.com/2009/01/25/john-dufresne-requiem-mass/"">http://covertocover.podbean.com/2009/01/25/john-dufresne-requiem-mass/</a> <br/><br/> <a href=""http://gpbcovertocover.blogspot.com/2009/01/john-dufresnes-requiem-mass.html"">http://gpbcovertocover.blogspot.com/2009/01/john-dufresnes-requiem-mass.html</a></div>",,,,,https://francolibrary.com/archive/files/1dd9f4d9b2c603838360b8bd7ce7ae44.jpg,Audio;Criticism and Review;Fiction and Literature;Georgia;Personal History: Biography and Oral History;Worcester MA,Audio & Video
My Brother the Murderer,"Online feature entitled ""What happens when the world finds out that God is dead?: Ron Currie, Jr. reads from his novel."" The feature is a link to the author's reading of the chapter ""My Brother the Murderer"" from his novel titled ""God is Dead"" (2007). In this piece, a man faces public and private alienation for the abominable actions of his brother now locked away in an Augusta, Maine mental hospital.","Currie, Ron, Jr.",Listen: AUDIO,,2009 Spring,,English,,,Streaming audio,Audio Recording,"<a href=""http://www.worldcat.org/oclc/74460731"">74460731</a>",,,,,,,,,WAV,,00:27:39,,,,,,,Bosphorus Art Project Quarterly,"<div class=""element-text""><a href=""http://www.bapq.net/spring-09/feature_ron-currie_reads.asp"">http://www.bapq.net/spring-09/feature_ron-currie_reads.asp</a> (full audio available)</div>",4,,,,,Augusta ME;Death and Disaster;Family;Gender and Sexuality;Maine;Violence;Waterville ME,Audio & Video
Les objectifs de Paul LePage à  titre de gouverneur du Maine,"Une vidéo des nouvelles sur le début de l'administration du gouverneur Paul Lepage dans l'État du Maine, et certains de ses visions pour l'avenir de l'Etat.","L'Italien, Rosaire",,,2011 janvier 5,,Français,,,,TV Broadcast,,"2011, Maine",,,,,,,RDI,,,00:06:38,,Canada,,,,,,"<div class=""element-text""><a href=""http://www.radio-canada.ca/regions/atlantique/2011/01/05/003-paul-lepage-serment.shtml#"">http://www.radio-canada.ca/regions/atlantique/2011/01/05/003-paul-lepage-serment.shtml#</a></div>",,,,,https://francolibrary.com/archive/files/36e1e144b7349f2213ef721c7237eff7.jpg,Augusta ME;Ethnicity and Collective Identity;Government and Politics;Maine;Waterville ME,Audio & Video
"Quittons Pour Mieux Vivre, Let's Leave for a Better Life : A Story of Franco-Americans in Maine","Dramatic student portrayal of French Canadian immigration to Maine at the beginning of the twentieth century. Contains scenes of family life in Quebec, dramatic reenactment of work in the mills of Maine, prayer and party in the United States, and various music and dance. Film adaptation of a stage production.","Hyde School;Brunswick High School;Searles, James (project director);Tibbetts, Michelle (student project director);Best, Calvin (student project director)",,,1980,,English and français,,,,Film,"<a href=""http://www.worldcat.org/oclc/63898970"">63898970</a>","1920, Maine",Documentary,,"Fuller, David",,,,,,,00:30:00,,,,,,,,"<div class=""element-text""><a href=""http://www.maine.gov/msl/libs/media/subjects/mshist.htm"">http://www.maine.gov/msl/libs/media/subjects/mshist.htm</a></div>",,,,,https://francolibrary.com/archive/files/6c5f04a9525fb711776a7c3a4324bae7.jpg,Canada;Community: Customs and Social Life;Education;Emigration and Immigration;Ethnicity and Collective Identity;Film and Television;Maine;Mills and Mill Work;Music;Performing Arts;Québec;Social History;Youth,Audio & Video
Milltown,"Theatrical portrayal of a girl seeing her ancestors in their belongings, their letters, and the mills in which they worked. Reenactment of life in the Amoskeag mill complex in Manchester, New Hampshire. Many video clips and photos of that same complex, much of which has since been demolished. From WorldCat: "" From WorldCat: ""Essai cinématographique de style impressionniste sur l'immigration et la vie des franco-canadiens dans les petites villes du textile de la Nouvelle-Angleterre durant les années 1880-1930, aè partir de l'exemple de Manchester, au New Hampshire. Illustration d'objets et de photos d'époque. Regard sur la démolition des entrepoêts et des filatures actuellement en cours. Film sans commentaire.""	","Perreault, Denise Arel ;Samson, Gary ",,,1977,,English and français,,,,Film,"<a href=""http://www.worldcat.org/oclc/77159416"">77159416</a>","1970s, Manchester, New Hampshire",Experimental,,,,,,,,,00:10:00,,,,,,,,,,,,,,Emigration and Immigration;Ethnicity and Collective Identity;Film and Television;Labor History;Manchester NH;Mills and Mill Work;New England;Québec;Social History,Audio & Video
Acadian Home Cooking : At Mom's Apron Strings,"Oral interview with the owner of Café de le Place in Madawaska, Maine. The role of food in his family life and historically in the lives of the Acadians of the St. John River Valley. Some descriptions of famous Acadian dishes. Recorded in the Story Bank mobile recording studio at the 2009 American Folk Festival in Bangor, Maine. Presented in video montage form: interview audio with pictures of the interviewee, his family, and his work.","Corbin, Michael;Rosenthal, Rob",,,2009 March 5,,English and français,,,,Audio Recording,,"2009, Bangor, Madawaska, Maine",,,,,,,,,,00:04:07,,"Bangor, Maine",,,,,,"<div class=""element-text""><a href=""http://storybankmaine.org/2009/03/05/acadian-chef-michael-corbin/"">http://storybankmaine.org/2009/03/05/acadian-chef-michael-corbin/</a></div>",,,,,https://francolibrary.com/archive/files/81338ba44ed326a2d957d7e7f799c9fb.jpg,Acadians;Bangor ME;Community: Customs and Social Life;Ethnicity and Collective Identity;Family;Food;Grand Isle ME;Madawaska ME;Personal History: Biography and Oral History;St. John River Valley,Audio & Video
Growing Up Franco In Lewiston,"Oral interview with a woman recalling her youth and family in Lewiston, Maine. Her memories of the pervasiveness of French language and culture in the first half of the twentieth century, and her thoughts on the decline of French language and community. Recollections of her family's Catholic piety. The ways in which French language and Franco American culture remain part of her adult life. Recorded in the Story Bank mobile recording studio at the 2009 American Folk Festival in Bangor, Maine.","Lothian, Mona",,,2009 November 12,"Rosenthal, Rob;Mundell, Kathleen;Lockhart, Jessica",English,,,Streaming Audio ,Audio Recording,,"20th century and 21st century, Bangor, Lewiston, Maine",,,,,,,,,,,,"Bangor, Maine",,,,,,"<div class=""element-text""><a href=""http://storybankmaine.org/2009/11/12/growing-up-franco-in-lewiston/"">http://storybankmaine.org/2009/11/12/growing-up-franco-in-lewiston/</a></div>",,,,,https://francolibrary.com/archive/files/0c3fe9d6420a3a4fa32f3ac33f6da25e.jpg,Acculturation and Assimilation;Bangor ME;Community: Customs and Social Life;Education;Ethnicity and Collective Identity;Food;Language and Linguistics;Lewiston ME;Mills and Mill Work;Personal History: Biography and Oral History;Religion,Audio & Video
Hot Lunch : In the Kitchen at Biddeford High School,"Audio recording of kitchen and cafeteria workers of Biddeford High School in Biddeford, Maine, accompanied by a video photo montage. Brief interviews during the workday and short profiles of the kitchen staff.","Dilling, Audrey;Lovell, Catherine (photography)",Watch: SLIDESHOW w/ AUDIO,,2010 February,,English,,,,Video Recording,,"2009; Biddeford, Maine",,,,,,,,,,00:04:10,,"Biddeford, Maine",,,,,,"<div class=""element-text""><a href=""http://www.vimeo.com/9717261"">http://www.vimeo.com/9717261</a> <br/><br/> <a href=""http://www.audreydilling.com/about/"">http://www.audreydilling.com/about/</a></div>",,,,,https://francolibrary.com/archive/files/50154d580aacbf745cd6dec2940aaf47.JPG,Biddeford ME;Community: Customs and Social Life;Education;Food;Labor History;Personal History: Biography and Oral History;Social History;Youth,Audio & Video
Hot Lunch,"Documentary radio piece on the cooks and servers - the ""lunch ladies"" - in the kitchen at Biddeford High School in Biddeford, Maine. How their work often transcends food service and their relationships with students become compassionate and somewhat parental. This recording is a student project of the SALT Institute in Portland, Maine. Broadcast by New Hampshire Public Radio on the program ""Word of Mouth,"" January 7, 2010.","Dilling, Audrey",,,2009 Fall,,English,,,,Audio Recording,,"2009, Biddeford, Maine",,,,,,,,,,00:05:11,,"Biddeford, Maine",,,,,,"<div class=""element-text""><a href=""http://www.salt.edu/studentwork/radio/?studentwork_id=26"">http://www.salt.edu/studentwork/radio/?studentwork_id=26</a> <br/><br/> <a href=""http://www.nhpr.org/node/28576"">http://www.nhpr.org/node/28576</a> <br/><br/> <a href=""http://www.audreydilling.com/about/"">http://www.audreydilling.com/about/</a></div>",,,,,,Biddeford ME;Community: Customs and Social Life;Education;Food;Labor History;Personal History: Biography and Oral History;Social History;Youth,Audio & Video
"No Praise, No Blame, Just So","Radio documentary piece on the violent invasion of the Waterville, Maine, convent of the Servants of the Blessed Sacrament in 1996. The death of two nuns, the recollections of surviving sisters, and how their community has chosen to live and express its forgiveness for the man at fault. This recording is a student project of the SALT Institute in Portland, Maine. Aired by National Public Radio on November 17, 2008, and now available at npr.org.","Alpert, Jessica ",,,2008 Spring,,English,,,,Audio Recording,,"2008, Waterville, Maine",,,,,,,,,,00:07:43,,"Waterville, Maine",,,,,,"<div class=""element-text""><a href=""http://www.salt.edu/studentwork/radio/?studentwork_id=4""> <br/><br/> </a><a href=""http://www.npr.org/templates/story/story.php?storyId=97092716"">http://www.npr.org/templates/story/story.php?storyId=97092716</a></div>",,,,,,Community: Customs and Social Life;Death and Disaster;Family;Religion;Rome IT;Violence;Waterville ME,Audio & Video
FAROG Group : Québékiss discussion,"Recording of a 1973 FAROG (Franco-American Resource Opportunity Group) student meeting at the University of Maine at Orono. Beginning in the early 1970s, the group would meet on a regular basis and, among other things, involve themselves in exploratory discussion. This particular meeting begins with a reflection on the song entitled ""Québékiss,"" and turns into an exploration of identity, of college, and of ideas about ""freedom.""","Labbé, Yvon A. ",,,1973,"Bolduc, Claire;Colin, Cécile;Dodge, Elizabeth Ardoin;Michaud, Maxine;Roberge, Céleste ;Violette, Mark","English, with some français",,,,Video Recording,,"1973, Orono, Maine",,,,,,,,,,ca. 60 mins.,,"Orono, Maine",,,,,,"<div class=""element-text""><a href=""http://www.francoamerican.org/home.php"">http://www.francoamerican.org/home.php</a></div>",,,,,,Education;Ethnicity and Collective Identity;Language and Linguistics;Music;Orono ME,Audio & Video
Reflets et lumieère : Porte ouverte sur la communauté de Old Town,"Second episode in a public broadcasting documentary series on Franco Americans in Maine at the beginning of the 1980s. Composed of two major segments. In the first segment, a video essay entitled ""Bells and Whistles,"" Eugene Paradis guides viewers through the history of Old Town, Maine, up to the present. The second segment is a closer look into the French Island community of Old Town. Both segments are introduced in French with English subtitles, while the segments themselves are mostly in English with portions of subtitled French conversation. The program is followed by a brief reaction by French-speaking puppets, ""Patate"" et ""Pitune.""","Greenman, John",,,1981,"Sorg, Marcella ;Labbé, Yvon ;Pelletier, Raymond ;Paradis, Eugene ;Yvon, Bernard ;Gallagher, Jim ;Bolduc, Claire ",English and français,,,,TV Broadcast,,"1980s, Old Town, Maine",,,"Greenman, John ","Duplessis, Ludger (co-host);Duplessis, Steffan (co-host)",2,English and français,Maine Public Broadcasting Network (MPBN),,,,,,,,,,,,,,,,https://francolibrary.com/archive/files/a9859ff2f34f3bcc9ba8d0a4addec64f.jpg,Acculturation and Assimilation;Bradley ME;Community: Customs and Social Life;Education;Family;Forestry;French Island ME;Labor History;Language and Linguistics;Milford ME;Mills and Mill Work;Native Americans;Old Town ME;Religion;Social History;Youth,Audio & Video
"Ron Currie, Jr. discusses Everything Matters!","Waterville, Maine, writer, Ron Currie, Jr., discusses his book ""Everything Matters!,"" his life, and his writing, and takes questions from Duke University's class of 2014. Currie's novel was chosen to be read and discussed by the entire first-year class at Duke.",Duke Alumni Association,Watch: VIDEO,,2010 August 31,Duke Alumni Association,English,,,Streaming Video ,Video Recording,,"2010; Durham, North Carolina",,,,,,,,,,00:51:07,,"Durham, North Carolina",,,,,,"<div class=""element-text""><a href=""http://www.youtube.com/watch?v=R_461JCPEus&amp;feature=youtube_gdata_player"">http://www.youtube.com/watch?v=R_461JCPEus&amp;feature=youtube_gdata_player</a></div>",,,,,,Education;Fiction and Literature;Maine;North Carolina;Personal History: Biography and Oral History;Waterville ME,Audio & Video
