title,description,creator,source,publisher,date,contributor,language,rights,relation,format,type1,identifier,coverage,zotero_genre,zotero_distributor,zotero_director,z_performer,zotero_episode_number,zotero_language,zotero_network,zotero_audio_recording_format,zotero_label,zotero_running_time,zotero_num_pages,zotero_place,zotero_publisher,zotero_issn,zotero_isbn,zotero_issue,zotero_publication_title,z_url,zotero_volume,zotero_short_title,z_ref,type2,files,tags,collection
Speaking in Tongues,"Documentary film on multilingual and multicultural education in the United States. The personal, social, and political implications of teaching in languages other than English, and the complex realities of immigrant families' hopes for their children's education. Set in California, in the context of various states considering ""English only"" legislation. Considers the developmental benefits of multilingual youth education. From PatchWork Productions: ""In a time where 31 states have passed English Only initiatives, one urban school district is exploring the provocative notion that speaking a foreign language can be a national asset. We follow four diverse students and their families as they encounter the challenges and delights of becoming fluent in two languages. As we witness their journey, we see how speaking more than one language changes them, their families, their communities, and maybe even the world.""","Jarmel, Marcia;Schneider, Ken",,,2010,,English (Spanish and Chinese audio and subtitles),,,,Film,"<a href=""http://www.worldcat.org/oclc/435619912"">435619912</a>","2010, California, United States",Documentary,PatchWorks Productions,,,,,,,,00:57:00,,,,,,,,"<div class=""element-text""><a href=""http://speakingintonguesfilm.info"">http://speakingintonguesfilm.info</a> (see film trailer here)</div>",,,,,https://francolibrary.com/archive/files/8b0b3848eeaf574974d2107aa327a608.JPG,California;Demography;Education;Film and Television;Government and Politics;Language and Linguistics;San Francisco CA;United States,Audio & Video
Chantons--Let's Sing [in French & English] : Traditional French Songs,"Audio recording of 14 French songs performed in both French and English and accompanied by fiddle. Partnered with a song book containing sheet music, lyrics, lyric translations, and storied introductions to each song. Book concludes with some suggestions for incorporating its music into school lessons, in particular a curriculum designed for use under the provisions of the Maine Learning Results.","Parent, Michael (vocals);Boardman, Greg (fiddle)",,,1999,,Français and English,,,,Audio Recording,"<a href=""http://www.worldcat.org/oclc/671673224"">671673224</a>",,,,,,,,,CD,,00:34:48,16,"Lewiston, Maine",L/A Arts,,,,,"<div class=""element-text""><a href=""http://www.michaelparentstorytelling.com/michaelparent_audio.html"">http://www.michaelparentstorytelling.com/michaelparent_audio.html</a></div>",,,,,https://francolibrary.com/archive/files/ba19992b140edf28a506c80638c03654.jpg,Acadians;Community: Customs and Social Life;Education;Language and Linguistics;Lewiston ME;Music,Audio & Video
Chants Populaires des Franco-Américains,"Un recueil des chansons langue française (de France, Canada, et les Etats-Unis) publié par un société fraternelle franco-américain pour les Franco-Américains de la Nouvelle-Angleterre. Un hommage à  la musique traditionnelle française en Amérique et une tentative de le préserver dans la musique et les paroles ensemble dans une partition musicale.  Formée de huit tomes des ""Chants populaires des Franco-Américains"" qui ont été publiés plus tôt et dans des éditions séparées.  Contient les chansons suivantes:  A la claire fontaine (Quatuor) Barcarolle (Choeur) Bonsoir (Choeur de voix mixtes) Brigadier (Solo et choeur) Cantique à  St-Jean-Baptiste (Duo et choeur) Célébrons le Seigneur (Solo) C'est un oiseau qui vient de France (Solo) Chant national (Solo et choeur) Chant national Acadien (Choeur) Chantons le peuple Canadien (Choeur) Chants Canadiens (Quatuor pour voix egales) Choeur des soldats (Faust)(Quatuor) Comme nos pières (Solo et quatuor) Désillusion (Melodie) Dieu bénit celui qui donne (Solo) Dieu sauve la France! (Solo et choeur) Dors, petite soeur (Berceuse) Fédération (Choeur Hymne à  St-Jean-Baptiste (Choeur) Jeanne d'Arc (Solo et choeur) La Brabanconne (Solo) La charité (Romance) La foi (Choeur pour 3 voix de femmes) La Marseillaise (Choeur pour voix mixtes) La mière Michel (Pot-pourri) La patrie des birondelles (Duo) La plainte du mousse (Solo) La priière dans le bois (Duo) La sérénade des anges (Choeur pour 3 voix de femmes) Le crédo du paysan (Solo) Le crucifix (Chant religieux) Le drapeau de Carillon (Solo et quatuor) Le gondolier (Choeur) Le Noà«l du laboureur (Solo) Le petit doigt de la maman (Chansonnette pour les petits enfants) Le petit mousse noir (Solo et quatuor) Le régiment de Sambre et Meuse (Solo) Le rosier de mai (Solo et choeur) L'envers du ciel (Solo) Les anges du foyer (Solo) Les cloches du hameau (Solo et choeur) Les feuilles mortes (Romance) Les montagnards (Solo et choeur) Les rameaux (Romance) Les refrains du hameau (Quatuor pour voix d'hommes) Les vingt sous du bon Dieu (Romance) Ma Normandie (Romance) Marlborough (Choeur) Minuit, Nocturne, Sérénade sans accompagnement (Solo et quatuor) Mon âme à  Dieu, mon coeur à  toi (Solo et choeur) Mon léger bateau (Solo) O Canada (Choeur) O Canada (Quatuor pour voix d'hommes) O Canada, mon pays, mes amours (Solo) Pars (Romance) Quatre canards (Solo et choeur) Restons Français (Solo et choeur) Salut à  la France (Aria de concert) Silvio Pellico (Romance) Souvenirs de la patrie (Choeur pour quatre voix d'hommes) Souvenirs du jeune âge (Romance) The Star Spangled Banner (Choeur) Ton souvenir est toujours là  (Romance) Tyrolienne (Choeur) Un Canadien errant (Pot-pourri pour voix d'hommes) Vive la Canadienne (Choeur)","Viau, Eusièbe (rédacteur);Philie, J. Ernest (rédacteur)",,L'Union Saint-Jean-Baptiste d'Amérique,1929,,fr,,,,Book,"<a href=""http://www.worldcat.org/oclc/59732376"">59732376</a>;<a href=""http://www.worldcat.org/oclc/29086410"">29086410</a>;<a href=""http://www.worldcat.org/oclc/221940175"">221940175</a>",1929; Nouvelle-Angleterre,,,,,,Français,,,,,244,"Woonsocket, Rhode Island",L'Union Saint-Jean-Baptiste d'Amérique,,,,,"<div class=""element-text""><a href=""http://books.google.com/books?id=B74TNAAACAAJ"">Chants Populaires...</a> sur Google Books</div>",,,,,https://francolibrary.com/archive/files/1c7dbeb7139b03c75aeb83d2ebbe4ba4.jpg,Canada;Community: Customs and Social Life;Ethnicity and Collective Identity;Folklore;France;Music;New England;Québec;Springfield MA;United States;Woonsocket RI,Audio & Video
Franco-American Writers,"A WERU FM community radio broadcast of readings by two Maine writers, Rhea Côté Robbins and Trudy Chambers Price. Côté Robbins, who introduces her readings with a short talk on violence at home and in the workplace, shares from a work-in-progress entitled, ""down the Plains."" Chambers Price shares two chapters from her memoir, ""The Cows Are Out!: Two Decades on a Maine Dairy Farm"" (chapter 12, ""A Real Farmer's Tan,"" and chapter 10, ""The Cows Are Out!""). Readings are followed by a discussion with both writers about their lives, their work, and the stories that they and other Franco American women hold.","Clemons, Joan",,,2010 August 12,"Robbins, Rhea Côté;Price, Trudy Chambers",English and français,,,,Audio Recording,,"2010, Maine",,,,,,English and français,,MP3 (streaming; download),,00:59:13,,"Blue Hill, Maine",,,,,,"<div class=""element-text""><a href=""http://archives.weru.org/writers-forum/writers-forum-81210"">http://archives.weru.org/writers-forum/writers-forum-81210</a> (program available here to stream or download)</div>",,,,,https://francolibrary.com/archive/files/9441b0d3932f6c62eed6511bfac7df23.jpg,Caribou ME;Detroit ME;Dexter ME;Family;Farming and Agriculture;Fiction and Literature;Gender and Sexuality;Interview;Maine;Personal History: Biography and Oral History;Poetry;Radio;Violence;Wallagrass ME;Waterville ME,Audio & Video
Deep Woods and River Roads : Voices from the Kennebec-Chaudiière Heritage Corridor,"Subtitled, ""An Audio Tour of Route 201 in Maine."" A production of short interviews and other recordings that capture the people from each major section of Maine's historic route running north to south along the Kennebec River. Designed to accompany and advertise tourism along the Kennebec-Chaudiière Heritage Corridor. Narrated by National Public Radio's Nick Spitzer. Includes segments with artists, teachers, performers, cooks, loggers, fishermen, builders, painters, and more. Writers Wesley McNair and Richard Russo read from their work. Some history of the Penobscot Nation, Benedict Arnold's Expedition, the French Canadian immigration, Bath Iron Works, and other persons, places, and events important to the region.  Audio begins geographically in Jackman, Maine, and ends at Popham Beach, Maine. CD is accompanied by a descriptive guide with regional art and summaries of each covered geographic section along the Kennebec River. Contributors listed in order of appearance. Tracks play in the following order: Introduction Maple sugaring [Somerset County] Jackman in Winter [Jackman, ME] The Old Canada Road [Pleasant Ridge Plantation and Bingham, ME] Logging [Skowhegan, ME] White water rafting [Somerset County] Fiddleheading [West Forks, ME] Birch bark canoe making [Solon, ME] Fly fishing [Oakland, ME] South Solon Meeting House [Skowhegan, ME] Grange Hall [Norridgewock, ME] Poet, Wesley McNair [Mercer,ME] Franco-Americans in Waterville [Waterville, ME] Mills [Waterville, ME] Benedict Arnold [Pittston, ME] Merrymeeting Bay [near Bath, ME] Farming [Dresden, ME] Ship building [Bath and Phippsburg,ME] Lobstering [Bath, ME] Popham [Popham, ME] Outtro","Levin, Abbe (director);Mundell, Kathleen (folklorist);Spitzer, Nicholas (narrator)",,,2006,"Rodrigue, Claude;Paradise, Sara;LeMaire, Allen;Blood, Hal;Fountain, Barbie;Fountain, Joe;Pratt, George;Francoeur, Ray;Locke, Keldon;Hockmeyer, Suzie;Abraham, Harry;Dana, Barry;Meader, Abbott;Shahn, Abbey;Bozhkov, Daniel;Roderick, Susan;Donovan, Bob;Poudrier, Bethany;McNair, Wesley;Hallee, Roger;Marrache, Lisa;Robbins, Rhea Coêté;Larock, Cindy;Russo, Richard;Desjardin, Tom;Burroughs, Franklin, Jr.;Popp, Dave;Stevens, Rob;Kemberling, Ulricka;Tarbox, Jack;Wright, Amos;Stevens, Jane",English,,,,Audio Recording,"<a href=""http://www.worldcat.org/oclc/76810555"">76810555</a>","2006, Kennebec River Valley, Maine",,,,,,,,Compact disc,"Cultural Resources, Inc.",01:19:00,,"Rockport, Maine",,,,,,"<div class=""element-text""><a href=""http://www.midmainechamber.com/tourism/deepwoods.htm"">http://www.midmainechamber.com/tourism/deepwoods.htm</a></div>;<div class=""element-text""><a href=""http://www.cultural-resources.org/publications_n.html"">http://www.cultural-resources.org/publications_n.html</a></div>",,,,,https://francolibrary.com/archive/files/9ffd8db258b09b645ab09524223f36e0.jpg,Acculturation and Assimilation;Art and Architecture;Augusta ME;Bath ME;Business and Economics;Caratunk ME;Community: Customs and Social Life;Dead River Valley ME;Emigration and Immigration;Ethnicity and Collective Identity;Farming and Agriculture;Fishing;Folklore;Food;Forestry;Gardiner ME;Hallowell ME;Hunting;Jackman ME;Kennebec River Valley;Madison ME;Maine;Mercer ME;Mills and Mill Work;Moosehead Lake Region;Moxie ME;Native Americans;Norridgewock ME;Personal History: Biography and Oral History;Phippsburg ME;Pittston ME;Poetry;Popham ME;Québec;Richmond ME;Seguin Island ME;Skowhegan ME;Solon ME;Somerset County ME;Sports and Leisure;Travel and Movement;Waterville ME;West Forks ME,Audio & Video
La Bonne Aventure,"French-English bilingual educational television series for children. Designed ""to expose the Franco American child to simple elements of his/her culture"" (MPBN). Created in 1974 by Project FACTS (Franco-American Children's Television Series); produced by Maine Public Broadcasting Network and the University of Maine. Includes puppets, animation, and live-action video footage. Accompanied by Teacher Guides with thematic overview and synopsis of each episode, comments on cultural elements in each episode, suggested additional resources materials for teachers, and suggested activities for students. Description of episodes (20): Episode 1: Nouveaux amis / New Friends Introduction to series character children - Lise, Claude, Tit-Guy, Julie. The magical arrival of Dorik and Dondaine, two lutins of Franco American folklore. Features video footage of Augusta, Biddeford, Fort Kent, Lewiston, Madawaska, and Van Buren, Maine. Episode 2: Chez-nous / Our Place Finding themselves at the center of the children's attention, Dorik and Dondaine search for a place to be alone. Episode 3: Le rire / Laughter Dorik and Dondaine contemplate cultural difference as they encounter different perceptions of their English accent. Episode 4: La bonne aventure / The Good Adventure With the help of her friends, Julie confronts her fear of meeting new people and ventures out to create a film. Episode includes French Canadian fables. Features video footage of Augusta, Biddeford, Lewiston, the St. John Valley, and Waterville, Maine. Episode 5: Le travail / Work Lise and Tit-Guy help Dorik take pride and find value in his art work. Video footage and montage of different forms of work. Episode 6: L'horloge / The Clock The discovery of a giftbox with a clock set for 7:00PM opens up a discussion about ""le Bonhomme Sept-heures"" of Franco American folklore. Characters work to confront their fears. Episode 7: Le bazaar / The Bazaar Claude struggles to finish a series of collages he is supposed to bring to the next day's church bazaar. Characters learn about some of the differences between working independently and asking others for help.
Episode 8: Le réveillon / Christmas Eve CelebrationThe children celebrate Christmas Eve together with their families, but Dorik and Dondaine are missing. Includes a discussion of Franco American foods. Episode 9: La legende / The Legend A trip to the shipyard with Claude, Lise, Dorik, and Dondaine turns adventurous when the four become trapped in an old ship. In the hopes of calming them, Dorik shares a legend with the children. Features video footage from Bath Iron Works in Bath, Maine. Episode 10: Les explorateurs / The Explorers Claude and Lise venture into the attic to explore through a trunk filled with their pépière's old belongings. After the children uncover stories from their Québec heritage, Tit-Guy explains his mémière's Acadian roots.  Features video footage of Rhode Island Governor, Philip Noel, and a photo montage of St.-Jean-Baptiste Day celebrations.  Episode 11: La déportation / The Deportation Playing hide-and-seek after talking about her Acadian heritage with Tit-Guy, Julie's cardboard box hiding spot is magically moved out of the house. Julie and Dondaine search for a way home. Information on the Acadian Deportation. Features video footage of Augusta, Biddeford, Lewiston, the St. John Valley, and Waterville, Maine, as well as footage from Manchester and Nashua, New Hampshire; Lowell, Fall River, and western Massachusetts; and Woonsocket, Rhode Island. Episode 12: Achale moé  pas / A Problem of Feelings As Julie tries to draw a bowl of fruit, she is interrupted and upset in multiple ways by her friends. How she deals with anger and impatience. Episode 13: La bêtise / The Mistake Before a trip to the sugar shack, Lise accidentally unravels a scarf knitted for her by her mémière. Features video footage of ""la tire sur la neige,"" or taffy on the snow, at a sugar shack during the maple sugar harvest. Episode 14: Le prix / The Prize Sibling tensions arise as Claude resents Lise's spelling bee victory trophy and the attention she receives. Features video footage of a community bean supper. Episode 15: La quête / The Quest After Julie falls asleep reading about French-speaking people in the history of America, the time-machine she had been tinkering disappears Dorik to parts unknown. Julie travels through American history - to colonial Boston, Philadelphia, and elsewhere - on a search for her friend. Features Robert de la Salle, George Washington, Benjamin Franklin, and other figures in American history.  Episode 16: L'annonce / The Commercial Tit-Guy recites a poem he has prepared for a television station. His friends offer advice and critique his style in various ways, and he must choose the best way to perform. Features video footage from Franco American communities outside of Maine. Episode 17: Les plans / The Plans After Lise is informed she cannot go to the zoo, that her parents have other plans for her, she imagines running away from home. Discussion of Franco American fairs. Features video footage of Benson's Animal Farm in Hudson, New Hampshire. Episode 18: L'invention / The Invention As Julie tinkers with her malfunctioning new invention, a thought-reflection-projector box, she is confronted with gender stereotypes from her friends.  Features video footage of a community beano game and the mayor of Lewiston, Maine. Episode 19: La trouvaille / The Lucky Find Tit-Guy finds a precious object and claims it his own as Dondaine realizes her rose bénite, the same object, is missing. Episode 20: Au Revoir is Not Goodbye Claude, Lise, Tit-Guy, and Julie reminisce on their happy times with Dorik and Dondaine. The children prepare a party before les lutins must depart.","Roy, Suzanne R.",Watch: ALL EPISODES,Maine Public Broadcasting Network,1974,,English and français,,,,Moving Image,"<a href=""http://www.worldcat.org/oclc/3404725"">3404725</a>",1974; Maine,,,"Pepin, Nelson A.",,2025-01-20 00:00:00,,,,,ca. 14:35,,,,,,,,"<div class=""element-text""><a href=""http://francolib.francoamerican.org/galleries/aventure"">http://francolib.francoamerican.org/galleries/aventure</a></div>",,,,,https://francolibrary.com/archive/files/258c26c02449cb06b231378fdce1c082.jpg,Acadians;Augusta ME;Biddeford ME;Boston MA;Community: Customs and Social Life;Education;Fall River MA;Family;Film and Television;Folklore;Language and Linguistics;Lewiston ME;Lowell MA;Madawaska ME;Maine;Manchester NH;Nashua NH;New England;Philadelphia PA;Québec;Religion;St. John River Valley;Van Buren ME;Waterville ME;Woonsocket RI;Youth,Audio & Video
Chantons!,Livret de titres de chansons françaises et anglaises et de leurs paroles.  Booklet of French and English song titles and their lyrics.,"L'Union Saint-Jean-Baptiste d'Amérique de Woonsocket, Rhode Island",,L'Union Saint-Jean-Baptiste d'Amérique,19[??],,English et français,,,,Document,"<a href=""http://www.worldcat.org/oclc/33982319"">33982319</a>","20e siiècle; Woonsocket, Rhode Island; Nouvelle-Angleterre",,,,,,,,,,,,,,,,,,"<div class=""element-text""><a href=""http://books.google.com/books/about/Chantons.html?id=fvqNYgEACAAJ"">Chantons! sur Google Books</a></div>",,,,,https://francolibrary.com/archive/files/a555adbe762507a2947b248e10ad00a4.jpg,Clubs and Societies;Music;Woonsocket RI,Audio & Video
Where is the French in Lewiston?,"Radio piece on the transformations of French language and Franco American culture in Lewiston, Maine, in the 21st century. Features Marie Marthe Rivard, a 1922 immigrant from Québec to Lewiston, at her home, at work, and at Catholic mass. Some thoughts on her own languages and the speaking of French within her family. Impressions of local culture from a Lewiston priest and a local French language teacher. Produced, with photographs, for the Salt Gallery of the Salt Institute for Documentary Studies in Portland, Maine.","Elzas, Sarah (producer) ",Listen: AUDIO;Read: TRANSCRIPT,,2004 August 30,,"English, with some français",,,,Radio Broadcast,,"2004; Lewiston, Maine",,,,,,,,,,00:07:14,,"Lewiston, Maine",,,,,,"<div class=""element-text""><a href=""http://www.toucanradio.org/lewistontranscript.html"">http://www.toucanradio.org/lewistontranscript.html</a></div>",,,,,,Acculturation and Assimilation;Androscoggin River Valley;Auburn ME;Education;Family;Language and Linguistics;Lewiston ME;Mills and Mill Work;Radio;Religion;Youth,Audio & Video
Chansons de Chez-Nous,"Music and lyrics for 31 French-language songs of French, French-Canadian, and Acadian origins. Designed for the language-learning classroom. Text is divided into three sections for appropriate audiences: children 5-7 years old; 8-9 years old; 10 and older. Accompanied by two cassette tapes with recordings of each song. La musique et les paroles de 31 chansons d'origine française, canadienne-française, et acadienne. Conçu pour la classe d'apprentissage de la langue française. Le texte est divisé en trois sections: pour les enfants 5-7 ans; 8-9 ans; 10 ans et plus. Accompagné de deux cassettes contenant des enregistrements de chaque chanson. Les chansons suivantes: DE CINQ A SEPT ANS: C'est la poulette grise Mon beau sapin Ah! Vous dirai-je, Maman La cabane à  sucre Berceuse slave Les cloches du hameau Evangéline DE HUIT A NEUF ANS: Bonhomme, Bonhomme! Meunier tu dors Au fond des campagnes Le carillonneur V'la l'bon vent Mon merle Sur la route de Berthier Trois jeunes tambours Le Corbeau et le Renard La Cigale et la Fourmi DE DIX A ONZE ANS: Vive le vent Un Canadien errant Michaud est tombe Berceuse Vive la Canadienne Sainte nuit Quand j'étais chez mon pere A la volette Fringue, fringue, sur la riviere Partons, la mer est belle Le moulin A Saint-Malo, beau port de mer Derriere chez-nous Mon pere, j'voudrais m'marier","Albert, Renaud S. (editor)",Read: FULL TEXT;Download: PDF,National Materials Development Center,1978,"Albert, Julie D. (illustrations);Blais, Lise M. (sheet music);Douillard, Sr. Jeanne (vocals);Snow, Sr. Suzanne (vocals)",Français,,,,Book,"<a href=""http://www.worldcat.org/oclc/9985485"">9985485</a>;<a href=""http://www.worldcat.org/oclc/27235256"">27235256</a>","Nouvelle-Angleterre; Canada, France",,,,,,,,,,,61,"Bedford, New Hampshire",National Materials Development Center,,,,,,,,,,https://francolibrary.com/archive/files/efda7a3e8a321435b7a03cf45d865c86.jpg;https://francolibrary.com/archive/files/94d95262bf5f0e4ef5521e165579bacc.pdf,Acadians;Community: Customs and Social Life;Education;France;Music;New England;NMDC;Québec,Audio & Video
