title,description,creator,source,publisher,date,contributor,language,rights,relation,format,type1,identifier,coverage,zotero_genre,zotero_distributor,zotero_director,z_performer,zotero_episode_number,zotero_language,zotero_network,zotero_audio_recording_format,zotero_label,zotero_running_time,zotero_num_pages,zotero_place,zotero_publisher,zotero_issn,zotero_isbn,zotero_issue,zotero_publication_title,z_url,zotero_volume,zotero_short_title,z_ref,type2,files,tags,collection
Inside Peyton Place : The Life of Grace Metalious,"Biography of Manchester, New Hampshire author Grace Metalious. Famous for her novel ""Peyton Place"" and its various film adaptations. Emily Toth is also the biographer of novelist Kate Chopin.

From University Press of Mississippi: ""The juicy biography of the scandalous novelist who lifted the lid off a New England town...Grace Metalious, an unpretentious housewife from the wrong side of the tracks, had written an explosive bestseller. From a ramshackle cottage in a small New England milltown, she zoomed to national stardom. She met movie stars, famous writers, and the hangers-on who gravitate to those who achieve sudden wealth. She partied with the glamorous; she traveled; always a generous friend, she entertained lavishly. It was a Cinderella dream. But it did not last....Grace refused to be confined by the fifties' notions of a woman's place. In her struggle to find herself, she lifted the lid off sex and violence, power and powerlessness, truth and hypocrisy, and became known as the Pandora in Blue Jeans. 'If I'm a lousy writer,' she said, 'then an awful lot of people have got lousy taste.'...Emily Toth has given us a complete and sympathetic portrait of Grace: the idealistic young scribbler, the partier, the sometimes reluctant wife and mother. Tracing the television shows, the films, the Peyton Place sequels and later novels, Toth shows Grace plagued by periods of self-doubt and loneliness, striving desperately and feeling pressured to create another 'hit.'""

","Toth, Emily",,Doubleday,1981,,,,,,Book,"<a href=""http://www.worldcat.org/oclc/7247649"">7247649</a>","20th century, New Hampshire",,,,,,,,,,,395,"Garden City, New York",,,0385159501,,,"<div class=""element-text""><a href=""http://www.upress.state.ms.us/books/399"">http://www.upress.state.ms.us/books/399</a> <br/><br/> <a href=""http://books.google.com/books?id=XVdI6PQsZaUC&amp;source=gbs_navlinks_s"">Inside Peyton Place... @ Google Books</a></div>",,,,,https://francolibrary.com/archive/files/1f117efe0aff7fa089566f346d1f3b72.jpg,Alcohol and Drugs;Criticism and Review;Family;Fiction and Literature;Gender and Sexuality;Literary Works -- Criticism and History;Manchester NH;New England;New Hampshire;Personal History: Biography and Oral History,Biographies & Autobiographies
Little Pine to King Spruce : A Franco-American Childhood,"Memoirs of Fran Pelletier. His family and his youth in rural Maine. Growing up in small town America. From the back cover: ""Fran Pelletier is a rare and wonderful storyteller. He Grew up in Milford, Maine, in the 1930s....Pelletier remembers all the details in a series of stories that beg to be read aloud and shared. Authentically small-town American, yet spiced by his French-Canadian heritage, these stories will resonate in communities throughout New England.""","Pelletier, Fran",,Tilbury House,2003,,English,,,,Book,"<a href=""http://www.worldcat.org/oclc/52819582"">52819582</a>","20th century, Maine",,,,,,,,,,,190,"Gardiner, Maine",Tilbury House,,,,,"<div class=""element-text""><a href=""http://www.tilburyhouse.com/maine-and-new-england/little-pine-to-king-spruce.htm"">http://www.tilburyhouse.com/maine-and-new-england/little-pine-to-king-spruce.htm</a></div>;<div class=""element-text""><a href=""http://books.google.com/books?id=jxIHAAAACAAJ&amp;dq=pelletier%3B+little+pine+to+king+spruce&amp;hl=en&amp;ei=9c4gTOyrFMGB8gbm4flZ&amp;sa=X&amp;oi=book_result&amp;ct=result&amp;resnum=1&amp;ved=0CC8Q6AEwAA"">From Little Pine to King Spruce... @ Google Books</a></div>",,,,,https://francolibrary.com/archive/files/fff29368aae2c3102410957eb9603951.jpg,Augusta ME;Bradley ME;Community: Customs and Social Life;Family;Food;Government and Politics;Language and Linguistics;Milford ME;New Harbor ME;Old Town ME;Personal History: Biography and Oral History;Religion;Youth,Biographies & Autobiographies
Nous sommes un peuple étrange,"Un essai par l'auteur des romans ""The Family"" et ""The Country,"" et aussi les mémoires, ""American Ghosts."" Il viens de Providence, Rhode Island. Partie d'une collection sur la culture française d'Amérique. Au début du texte, Plante se demande, ""quelles sont les influences de mes origines sur ce que j'écris?"" Donc, il utilise son arbre de famille, les routes culturelles de ses aieux, la religion, et la langue à  expliquer son rélation à  écriture, le contenu de ses œuvres,  et les raisons pour sa ""maniière de décrire"" particuliere comme écrivain bilingue. Il situe ses logiques dans certaines situations personnelles ou la différence culturelle l'apporta des apercus uniques de ses préoccupations en tant que personne d'héritage français, canadien, ou nord-américain aux Etats-Unis.","Plante, David",,Presses de l'Université Laval,1997,,Français,,,,Book Section,"<a href=""http://www.worldcat.org/oclc/37491176"">37491176</a>","20e siiècle, Etats-Unis.",,,,,,,,,,,,"Sainte-Foy, Québec",,,9.78276E+12,,,"<div class=""element-text""><a href=""http://bks7.books.google.com/books?id=NOWbuqXthBQC&amp;source=gbs_navlinks_s"">Nous sommes un peuple étrange @ Google Books</a> <br/><br/> <a href=""http://www.pulaval.com/catalogue/litterature-dialogue-interculturel-3342.html"">http://www.pulaval.com/catalogue/litterature-dialogue-interculturel-3342.html</a></div>",,,,,https://francolibrary.com/archive/files/032f9d3696949c9a639c738d89c7e3a3.JPG,Criticism and Review;Family;Fiction and Literature;France;Language and Linguistics;Native Americans;Providence RI;Québec;Religion;United States,Biographies & Autobiographies
"Pas de gêne : L'histoire d'Omer Marcoux, violoneux et sculpteur","Une histoire de la vie artistique et communautaire d'un homme franco-américain de New Hampshire. Racontée par lui-même, M. Marcoux - bûcheron, sculpteur, musicien, ami - comme vu dans les contes qui se présentent dans ses entrevues avec l'écrivain du texte. 10 chapitres, illustrée par photos et dessins en noir et blanc.  Traductions de quelques phrases idiomatiques.","Olivier, Julien",,National Materials Development Center for French,1981,"Pomeroy, Paul (photos);Perron, Thérièse (dessins)",Français,,,,Book,"<a href=""http://www.worldcat.org/oclc/9185697"">9185697</a>","1900-1981, Maine, New Hampshire, Québec",,,,,,,,,,,94,"Bedford, New Hampshire",,,,,,"<div class=""element-text""><a href=""http://books.google.com/books?id=-6phGQAACAAJ&amp;dq=pas+de+gene+;+omer+marcoux&amp;hl=en&amp;ei=8xaaTbP8Iq610QGZ_vTkCw&amp;sa=X&amp;oi=book_result&amp;ct=result&amp;resnum=5&amp;ved=0CDcQ6AEwBA"">Pas de gêne @ Google Books</a></div>",,,,,https://francolibrary.com/archive/files/a7dc8fd8cea3d12dbd068981d33ef5e1.jpg,Art and Architecture;Community: Customs and Social Life;Concord NH;Emigration and Immigration;Family;Folklore;Jackman ME;Merrimack River Valley;Music;New Hampshire;Personal History: Biography and Oral History;Québec;Religion,Biographies & Autobiographies
"Legacy : A Biography of Rev. Armand ""Spike"" Morissette, O.M.I.","The life of Father Armand Morissette - better known as Father Spike - Catholic priest of Lowell, Massachusetts. Father Spike was widely known for his compassion and ease of friendship, as well as for his community activism and ahead-of-the-curve political and theological views. Stories and memories of the Lowell native from his birth in 1910 to the book's publication in 1985. Includes his schooling, service as chaplain to the French Navy, his relationship with Jack Kerouac, and the breadth of his participation in public life. Appended with interviews with Father Spike, as well as a selection of several of his speeches.","Chartier, Armand;Chartier, Catherine Rivard ",,Works in Progress Press,1985,,English,,,,Book,"<a href=""http://www.worldcat.org/oclc/16000329"">16000329</a>","20th century, Lowell, Massachusetts",,,,,,,,,,,120,"Boston, Massachusetts",,,,,,"<div class=""element-text""><a href=""http://books.google.com/books?id=6xpOGwAACAAJ&amp;dq=legacy;+chartier&amp;hl=en&amp;ei=4zuoTd6kO4TUgQeH0YT0BQ&amp;sa=X&amp;oi=book_result&amp;ct=result&amp;resnum=1&amp;ved=0CCgQ6AEwAA"">Legacy... @ Google Books</a></div>",,,,,https://francolibrary.com/archive/files/d724384cb8145fdc54c845a86547eb78.jpg,Community: Customs and Social Life;Family;Hudson NH;Lowell MA;Massachusetts;Merrimack River Valley;New Hampshire;Personal History: Biography and Oral History;Religion,Biographies & Autobiographies
A Stigmatist : Marie-Rose Ferron,"An impassioned tribute to Marie-Rose Ferron, or ""Little Rose,"" of Woonsocket, Rhode Island. Little Rose is revered in local Catholic mysticism for her experience of the stigmata - the miraculous appearance of the wounds of Christ on her body - and the piety with which she led her short life. This book shares the story of Rose and the Ferron family through recollections, second-hand accounts, and historical research. A unique portrayal of the Franco American community of Woonsocket through the lens of its devout religiosity around the time of the Sentinellist Affair. Features the community's remembrances, its prayers, the phenomena it attributes to Rose, etc. Strangely crafted, with each chapter filled by often disconnected events related in single paragraphs separated by title headers. ","Savard Bonin, Jeanne ",,éditions Paulines,1988,,English (traduction du français),,,,Book,"<a href=""http://www.worldcat.org/oclc/166317572"">166317572</a>","20th century, Woonsocket, Rhode Island",,,,,,,,,,,265,"Sherbrooke, Québec",éditions Paulines,,9.78289E+12,,,"<div class=""element-text""><a href=""http://books.google.com/books?id=-HKiLuMymtEC&amp;source=gbs_navlinks_s"">A Stigmatist @ Google Books</a> (limited preview available)</div>",,,,,https://francolibrary.com/archive/files/469c5e25c247a979e6223a8bd7012c9a.JPG,Community: Customs and Social Life;Death and Disaster;Fall River MA;Family;Illness;New England;Providence RI;Québec;Religion;Woonsocket RI,Biographies & Autobiographies
Snow Man,"A profile of Boston and New York social activist, Urbain Ledoux. Ledoux, known as ""Mr. Zero,"" was an early advocate for the homeless and jobless of the United States. His parents emigrated from Quebec to work in Connecticut and Maine in the 19th century. This biographical, editorial piece sits among others in a volume dedicated to American public figures of the 1920s.","Busch, Niven ",,Ayer Publishing,1970,,English,,,,Book Section,"<a href=""http://www.worldcat.org/oclc/74922"">74922</a>","1920s, United States",,,,,,,,,,,,,,,9.78084E+12,,,"<div class=""element-text""><a href=""http://books.google.com/books?id=KApDVAomefAC&amp;source=gbs_navlinks_s"">Twenty-One Americans... @ Google Books</a></div>",,,,,,Boston MA;Business and Economics;Government and Politics;New York NY;Personal History: Biography and Oral History;Social History;United States;Washington DC,Biographies & Autobiographies
Odyssey of Love,"A biography of Westbrook, Maine, native, Sister Marie Ange Larrivee, a nun in the Order of the Presentation of Mary. Stories that take us from her youth in Westbrook, through her Canadian religious education, all the way to her travels in Europe and her experiences of World War II in France. From a Rumford, Maine, author.","Boyle-Durgin, Mary Louise",,Marylee Publishers,1994,,English,,,,Book,"<a href=""http://www.worldcat.org/oclc/31454810"">31454810</a>","20th century, Maine, Quebec, and Europe",,,,,,,,,,,218,"Dixfield, Maine",,,B0006F4G7M,,,"<div class=""element-text""><a href=""http://books.google.com/books?id=AMqzGwAACAAJ&amp;dq=%22odyssey+of+love%22%3B+mary+louise&amp;hl=en&amp;ei=erokTa7KM8L6lwehh4W3AQ&amp;sa=X&amp;oi=book_result&amp;ct=result&amp;resnum=1&amp;sqi=2&amp;ved=0CCoQ6AEwAA"">Odyssey of Love @ Google Books</a> <br/><br/> <a href=""http://www.sunjournal.com/node/283154"">Mary Louise Boyle-Durgin, September 24, 2009, obituary @ Sun Journal (Lewiston ME)</a></div>",,,,,,Biddeford ME;Canada;Dixfield ME;Education;Europe;Family;France;Gender and Sexuality;Island Pond VT;Maine;Methuen MA;Mexico ME;Music;New York NY;Personal History: Biography and Oral History;Québec;Religion;Switzerland;Travel and Movement;War;Westbrook ME,Biographies & Autobiographies
A Is for Allagash : A Lumberjack's Life,"Stories from the Allagash, Maine, of old. Told in 26 parts - one part for a salient word corresponding to each letter of the alphabet. Written from the recollections of a longtime Allagash resident. Interlocked portraits of his family and life there, set together in the manner of memoir. Illustrated in photos and color paintings of local settings. From the father of northern Maine fiction writer, Cathie Pelletier (a.k.a., K.C. McKinnon).","Pelletier, Louis",,Northern Maine Books,2010,"Pelletier, Cathie;Pelletier, Lulu (illustrations)",English,,,,Book,"<a href=""http://www.worldcat.org/oclc/694172904"">694172904</a>","20th century, Allagash, Maine",,,,,,,,,,,63,"Allagash, Maine",Northern Maine Books,,9.78097E+12,,,"<div class=""element-text""><a href=""http://www.northernmainebooks.com/"">http://www.northernmainebooks.com/</a> <br/><br/> <a href=""http://books.google.com/books?id=t5HObwAACAAJ&amp;dq=a+is+for+allagash&amp;hl=en&amp;ei=TKW1TbnKCIPL0QHhpfmWCQ&amp;sa=X&amp;oi=book_result&amp;ct=result&amp;resnum=1&amp;ved=0CDAQ6AEwAA"">A is for Allagash... @ Google Books</a></div>",,,,,https://francolibrary.com/archive/files/c0675cd52f18c509fe8b6a2d6c9b0453.jpg,Allagash ME;Allagash River Valley;Community: Customs and Social Life;Family;Forestry;Fort Kent ME;Maine;Personal History: Biography and Oral History;Religion;St. Francis ME;St. John River Valley;Washburn ME;Youth,Biographies & Autobiographies
Chére Ma-Ma,"Remembrances of a French Canadian family in New Hampshire, or the biography of a Canadian immigrant mother as written by her American daughter. Family life, work, and prayer in rural New England. Presented as if in flashback, with the story beginning as the daughter attempts to communicate with her aged and ill mother in a nursing home. Constructed in short vignettes pertinent to the mother's life as mother, each section set out with a descriptive header. Includes some poems from the author. From the book jacket: "" 'Chére Ma-Ma' (Dear Mom) is a true story which tells of the determination and perseverance of a French Canadian woman, Mathilda (Bourassa) Charest, who raised a family of twelve children, and how she survived the everyday circumstances of truth in poverty, especially so, during the country's Depression; and her love of God through the Catholic faith.""","Currier, Anne B.",,"Self-published (Ed Hatch, printer)",Unknown (ca. 1960),,English,,,,Book,"<a href=""http://www.worldcat.org/oclc/11455298"">11455298</a>","Early 20th century, New Hampshire",,,,,,,,,,,71,"Derry, New Hampshire",,,,,,"<div class=""element-text""><a href=""http://books.google.com/books?id=tDCsHAAACAAJ&amp;dq=Ch%C3%A9re+Ma-Ma&amp;hl=en&amp;ei=xTjNTbXZOITagQecpvjBDA&amp;sa=X&amp;oi=book_result&amp;ct=result&amp;resnum=1&amp;ved=0CDAQ6AEwAA"">Chére Ma-Ma @ Google Books</a></div>",,,,,https://francolibrary.com/archive/files/6f709780731f8c2d057dbd743009acc9.jpg,Auburn NH;Community: Customs and Social Life;Epping NH;Family;Farming and Agriculture;Food;Gender and Sexuality;Illness;New Hampshire;Personal History: Biography and Oral History;Poetry;Religion,Biographies & Autobiographies
Quebec to New England : The Life of Monsignor Charles Dauray,"Biography of a priest who emigrated to New England from Quebec and became an instrumental figure in the Providence, Rhode Island, Roman Catholic diocese. His early life in Canada, his movement to the United States on account of illness, and his lifelong attention to Rhode Island's Roman Catholics of the late nineteenth and early twentieth centuries. His pastoral leadership of Most Precious Blood Parish in Woonsocket. From Bruce Humphries, Inc., Publishers: ""The career of Monsignor Charles Dauray is actually the history of the French-speaking population of the Diocese of Providence, Rhode Island, from 1872 to 1931.""","Kennedy, Ambrose",,"Bruce Humphries, Incorporated",1948,,English,,,,Book,"<a href=""http://www.worldcat.org/oclc/414871"">414871</a>","1850-1950, Rhode Island",,,,,,,,,,,242,"Boston, Massachusetts",,,,,,"<div class=""element-text""><a href=""http://books.google.com/books?id=pNF_QwAACAAJ&amp;dq=quebec+to+new+england;+ambrose+kennedy&amp;hl=en&amp;ei=RJ3STaW4G6fk0QHEsNzYCw&amp;sa=X&amp;oi=book_result&amp;ct=result&amp;resnum=1&amp;ved=0CCoQ6AEwAA"">Quebec to New England... @ Google Books</a></div>",,,,,https://francolibrary.com/archive/files/26f5f1307c968da899f8c2916b62eba4.jpg,Acculturation and Assimilation;Blackstone River Valley;Bristol County MA;Central Falls RI;Community: Customs and Social Life;Education;Pawtucket RI;Personal History: Biography and Oral History;Providence RI;Québec;Religion;Rhode Island;Woonsocket RI,Biographies & Autobiographies
Man in the Middle,"Short personal essay written by a journalist from Maine.  Reflections on leaving Maine early in life, eventually for New York City, and returning for his retirement. His early commitment to mastering English in spite of his home French, and both the personal and the more general, historical issues that this choice and language loss raised for him upon his return. Arguments bolstered by events surrounding the mispronunciation of his French name, the cultural insensitivity he still finds in his home state, and the attempts of others to reckon with discrimination toward French cultures in Maine. First published serially in Le FAROG Forum , in three parts. Later included in a 1970s collection of materials entitled, ""Franco American Resources in Education"" developed by Claire Bolduc. As part of this collection, the essay is followed by six discussion questions related to issues raised by the author.","Gauvin, Aimé",,Franco-American Centre,1976 December,,English,,,,Document,"<a href=""http://www.worldcat.org/oclc/31186541"">31186541</a>","20th century, Maine",,,,,,,,,,,?? (original); 7 (reprint),,,,,,Le FAROG Forum; Franco American Resources in Education,"<div class=""element-text""><a href=""http://francolib.francoamerican.org/forum/FF_Vol_4_No_3.pdf"">Le FAROG Forum, Volume 4, Number 3</a></div>",,,,,https://francolibrary.com/archive/files/a4f697b1aecbaa8b3199886105bc8bc8.jpg;https://francolibrary.com/archive/files/80598fa83ffaebc1caa9b4f02076ae69.png,Acculturation and Assimilation;Bangor ME;Biddeford ME;Ethnicity and Collective Identity;Family;Journalism;Language and Linguistics;Maine;New England;New York NY;Personal History: Biography and Oral History;Pittsfield MA;Québec;Skowhegan ME;United States,Biographies & Autobiographies
Entre Amis,"Collection de lettres envoyées par P. Louis Lalande, S.J., à  son ami Arthur Prévost, du Québec, du Canada, des fois aux États-Unis, et d'ailleurs. Rend une chronique de la vie du prêtre et de sa relation avec son ami. Publiée sept ans apriès la mort de M. Prévost. 
<br/><br/>Contient une piièce décrivant l'émigration canadienne-française en Nouvelle-Angleterre et de la croissance dans ce lieu de la communauté francophone et catholique. (pp. 62-67)","Lalande, Louis, S.J.",,Imprimerie du Sacré-Coeur,1907,,Français,,,,Book,"<a href=""http://www.worldcat.org/oclc/427229617"">427229617</a>","jusqu'à  1900, Québec, Etats-Unis",,,,,,,,,,,"339
","Montréal, Québec",Imprimerie du Sacré-Coeur,,,,,"<div class=""element-text""><a href=""http://books.google.com/books/about/Entre_amis.html?id=Nra2QwAACAAJ"">Entre Amis... sur Google Books</a></div>",,,,,https://francolibrary.com/archive/files/071dbda127ed88056d8976c78c0b3f22.jpg,Boston MA;Canada;Education;France;Montréal QC;New England;New York NY;Old Orchard Beach ME;Personal History: Biography and Oral History;Québec;Religion;Rhode Island;Travel and Movement,Biographies & Autobiographies
"Thank you, Georgette : My 26 Years in the Legislature","Memoirs and selected speeches of a Maine state legislator from the city of Lewiston. Contains commentary on some of the campaigns, issues, actors, and events significant to Bérubé and her career in Maine politics between 1970 and 2000. Some of her accomplishments as the first woman representative of her city, and one of the longest-serving of any Maine legislator.  Contains the following chapters: Name's Georgette Remarks to Rotary International and Canadian Visitors 10/29/93 Growing Up In Lewiston Political Campaigns Issues and Programs Partisanship/Personalities Legislation GOVERNMENT Pot Pourri Random Thoughts Remarks On Key Issues","Bérubé, Georgette",,AuthorHouse,2004,,English,,,,Book,"<a href=""http://www.worldcat.org/oclc/61458038"">61458038</a>","20th century, Lewiston, Maine",,,,,,,,,,,129,"Bloomington, Indiana",AuthorHouse,,9.78142E+12,,,"<div class=""element-text""><a href=""http://books.google.com/books?id=zVMRKQAACAAJ&amp;dq=thank+you,+georgette&amp;hl=en&amp;sa=X&amp;ei=PSj7TtDSCan20gH6t_HHAg&amp;ved=0CDcQ6AEwAA"">Thank You, Georgette... @ Google Books</a></div>",,,,,https://francolibrary.com/archive/files/e6434f29e33c45a8af86e74be97a1c8d.jpg,Auburn ME;Augusta ME;Business and Economics;Gender and Sexuality;Government and Politics;Greene ME;Leeds ME;Lewiston ME;Lisbon ME;Livermore ME;Maine;Minot ME;Northern Ireland;Orono ME;Personal History: Biography and Oral History;Québec;Sabattus ME;South Africa;Turner ME;Wales ME,Biographies & Autobiographies
Once in a Lifetime : Tribute to a Friend and Companion in a World War II Experience,"Illustrated brief memoir of northern Maine women religious moving about France during World War II. The events leading up to, and the sequence of, a five-day journey from their Paris convent to a safe haven in St. Etienne. Written soon after the death of Sr. Josephine Theriault, by her friend, in honor of her and the war experience they shared together with Sr. Geraldine Violette.","Cyr, Sr. Marguerite",,Self-published,Unknown,,English,,,,Book,"<a href=""http://www.worldcat.org/oclc/19889308"">19889308</a>","1930s, France",,,,,,,,,,,20,"Van Buren, Maine",Self-published,,,,,"<div class=""element-text""><a href=""http://books.google.com/books?id=g07GHAAACAAJ&amp;dq=once+in+a+life+time;+cyr&amp;hl=en&amp;sa=X&amp;ei=NL8dT9LXLZDg2wXtw93sCw&amp;ved=0CDIQ6AEwAA"">Once in a Lifetime @ Google Books</a></div>",,,,,https://francolibrary.com/archive/files/b15b79033584324436a4836e61f36edd.jpg,France;Religion;St. John River Valley;Travel and Movement;Van Buren ME;War,Biographies & Autobiographies
Kerouac : The Definitive Biography,"Recent historical biography of Lowell, Massachusetts writer, Jack Kerouac. Based largely on primary sources. Written by an independent scholar whose childhood and later life was also spent in Lowell.","Maher, Paul, Jr.",,Taylor Trade Publications,2004,,English,,,,Book,"<a href=""http://www.worldcat.org/oclc/52347737"">52347737</a>;<a href=""http://www.worldcat.org/oclc/186671065"">186671065</a>","20th century; Lowell, Massachusetts; New York, New York",,,,,,,,,,,555,"Lanham, Maryland",Taylor Trade Publications,,9.78088E+12,,,"<div class=""element-text""><a href=""http://paulmaherjr.com/"">http://paulmaherjr.com/</a></div>;<div class=""element-text""><a href=""http://books.google.com/books?id=t7PK83dQy9MC&amp;dq=maher%3B+kerouac&amp;source=gbs_navlinks_s"">Kerouac: The Definitive Biography @ Google Books</a> (limited preview available)</div>",,,,,https://francolibrary.com/archive/files/e823ef1237caf42a119f4ab61fe0900b.jpg,Alcohol and Drugs;Denver CO;Ethnicity and Collective Identity;Family;Fiction and Literature;Florida;Lowell MA;Merrimack River Valley;Nashua NH;New York NY;Northport NY;Pawtucketville MA;Personal History: Biography and Oral History;Poetry;Religion;Travel and Movement;Youth,Biographies & Autobiographies
My Maine Summer,"Memories of a childhood summer in the author's hometown of Van Buren, Maine, with one week spent on a vacation in Portland. Focuses on friendship, family, and baseball.","Rossignol, Matthew Albert",,Moosehead Communications,1996,"Rossignol, Brian (illustrations)",English,,,,Book,"<a href=""http://www.worldcat.org/oclc/40651518"">40651518</a>",20th century; Maine,,,,,,,,,,,116,"Greenville, Maine",Moosehead Communications,,9.78096E+12,,,"<div class=""element-text""><a href=""http://books.google.com/books?id=uIW3AAAACAAJ&amp;dq=my+maine+summer&amp;hl=en&amp;sa=X&amp;ei=lcghT5OVM8T00gGtntDtCA&amp;ved=0CDIQ6AEwAA"">My Maine Summer... @ Google Books</a></div>",,,,,https://francolibrary.com/archive/files/238ff329c513c2bf6fd669504a68b7ac.jpg,Aroostook County ME;Family;Maine;Nonfiction -- Sports;Personal History: Biography and Oral History;Portland ME;Sports and Leisure;Van Buren ME;Youth,Biographies & Autobiographies
