title,description,creator,source,publisher,date,contributor,language,rights,relation,format,type1,identifier,coverage,zotero_genre,zotero_distributor,zotero_director,z_performer,zotero_episode_number,zotero_language,zotero_network,zotero_audio_recording_format,zotero_label,zotero_running_time,zotero_num_pages,zotero_place,zotero_publisher,zotero_issn,zotero_isbn,zotero_issue,zotero_publication_title,z_url,zotero_volume,zotero_short_title,z_ref,type2,files,tags,collection
"""Wednesday's Child"" : Excerpts","Some selections from Waterville, Maine, native Rhea Coêté Robbins's memoir, ""Wednesday's Child.""","Robbins, Rhea Coêté",,,2002-spr/sum,,en,,,,Journal Article,"<a href=""http://www.worldcat.org/oclc/60628349"">60628349</a>","1950-2000; Waterville, Maine",,,,,,,,,,,,,,,,,Québec Studies,"<div class=""element-text""><a href=""http://www.acqs.org/qc_studies_journal/table_of_contents.html"">http://www.acqs.org/qc_studies_journal/table_of_contents.html</a></div>",33,,,,,Ethnicity and Collective Identity;Fiction and Literature;Language and Linguistics;Personal History: Biography and Oral History;Waterville ME,Biographies & Autobiographies
Among My Souvenirs,"Memoirs of a priest from the St. John River Valley, Maine and New Brunswick, who was born in the first decade of the 20th century and spent most of his late life preaching in the Roman Catholic parishes of northern Maine. ","Marquis, Fr. Alphie",Read: FULL TEXT,Self-published,1980,,English,,,,Book,"<a href=""http://www.worldcat.org/oclc/22467565"">22467565</a>","20th century; St. John River Valley, Maine, New Brunswick",,,,,,,,,,,92,,,,,,,"<div class=""element-text""><a href=""http://books.google.com/books?id=I9_4QwAACAAJ&amp;dq=marquis%3B+among+my+souvenirs&amp;hl=en&amp;ei=DK_FTNKcEcP38AbY7Kj-BQ&amp;sa=X&amp;oi=book_result&amp;ct=result&amp;resnum=1&amp;ved=0CC8Q6AEwAA"">http://books.google.com/books?id=I9_4QwAACAAJ&amp;dq=marquis%3B+among+my+souvenirs&amp;hl=en&amp;ei=DK_FTNKcEcP38AbY7Kj-BQ&amp;sa=X&amp;oi=book_result&amp;ct=result&amp;resnum=1&amp;ved=0CC8Q6AEwAA</a></div>",,,,,,Alberta;Allagash ME;Baker Lake ME;Bangor ME;Calais ME;Chisholm ME;Community: Customs and Social Life;Ellsworth ME;Emigration and Immigration;Exploration and Colonization;Family;Farming and Agriculture;Fort Fairfield ME;Fort Kent ME;Frenchville ME;Grand Isle ME;Greenville ME;Limestone ME;Lincoln ME;Livermore ME;Madawaska ME;Maine;Michigan;Millinocket ME;Minnesota;Native Americans;New Brunswick;North Dakota;Oquossoc ME;Orono ME;Personal History: Biography and Oral History;Presque Isle ME;Québec;Rangeley ME;Religion;Rockwood ME;Rumford ME;Saskatchewan;St. Francis ME;St. Lawrence River Valley;St. Zacharie ME;Stratton ME;Wallagrass ME;Youth,Biographies & Autobiographies
The Girl from Peyton Place: A Biography of Grace Metalious,"A biography of the New Hampshire author, Grace Metalious, whose works include ""Peyton Place,"" ""The Tight White Collar,"" and ""No Adam in Eden."" 
","Metalious, George;O'Shea, June",,Dell Publishing,1965,,English,,,,Book,"<a href=""http://www.worldcat.org/oclc/5315878"">5315878</a>",,,,,,,,,,,,189,"New York, New York",,,,,,"<div class=""element-text""><a href=""http://books.google.com/books?id=mmnXPwAACAAJ&amp;dq=the+girl+from+peyton+place%3B+metalious&amp;cd=5"">http://books.google.com/books?id=mmnXPwAACAAJ&amp;dq=the+girl+from+peyton+place%3B+metalious&amp;cd=5</a></div>",,,,,,Alcohol and Drugs;Ethnicity and Collective Identity;Fiction and Literature;Gender and Sexuality;Literary Works -- Criticism and History;New Hampshire;Personal History: Biography and Oral History,Biographies & Autobiographies
A Place Called Spruce Knoll,"A book of short, autobiographical stories from a native of Old Town, Maine, and a resident of Gouldsboro. The subjects of her stories take a lot of their value from the author's longtime and current home, ""Spruce Knoll."" Paradis King is also the author of the memoir, ""Growing Up On Academy Hill"" (2002). ","Paradis King, Annette",,Self-published,2010,,English,,,,Book,,"20th-21st centuries, Maine",,,,,,,,,,,96,"Gouldsboro, Maine",,,,,,"<div class=""element-text""><a href=""http://fanset8.blogspot.com/2010/07/place-called-spruce-knoll.html"">http://fanset8.blogspot.com/2010/07/place-called-spruce-knoll.html</a></div>",,,,,,Community: Customs and Social Life;Family;Gouldsboro ME;Personal History: Biography and Oral History,Biographies & Autobiographies
Growing Up On Academy Hill: Remembering My French-Canadian-American Papa,"Biography of a father from his daughter's point of view, set in the context of Old Town, Maine, in the first half of the 20th century. From the author: ""'Growing Up On Academy Hill' honors [King's] father who encouraged all six of his children to finish high school, a not-so-common achievement for those hard times. Recalling his ideology Annette wrote: 'My father was born with an inexhaustible desire to feel the earth passing through his fingers, to smell newly plowed fields warmed by sunlight. Every spring he pointed joyfully to new beginnings, and with enthusiasm taught us the basics of all beauty. From one corner of a small piece of land to the other, we observed as children, life through his eyes.' A brother's thoughts: 'We were not from a very touchy-feely"" kind of family. However, our parents were not unloving, it was simply an unspoken love that was shared. I never heard Papa say, ""I love you"" to my mother, my sisters, or me. I never saw Papa kiss Mama. Yet the feeling of love was pervasive when I was a child.'"" ","Paradis King, Annette",,Self-published,2002,,English,,,,Book,,"20th century, Old Town, Maine",,,,,,,,,,,104,"Gouldsboro, Maine",,,,,,,,,,,,Community: Customs and Social Life;Family;Gender and Sexuality;Labor History;Mills and Mill Work;New England;Old Town ME;Personal History: Biography and Oral History;Religion;Youth,Biographies & Autobiographies
American Ghosts,"A memoir from prose writer David Plante. An exploration of identity with respect to language, the power of Catholic traditions, and the pull of sex, moving with the author from his Providence, Rhode Island, hometown through Europe and back again. From Publishers Weekly:  ""Haunted by the visible and invisible spirits of his life, Plante embarks on a remarkable journey of self-discovery. Traveling through a past littered with the ghosts of his ethnic lineage (French Canadian), his family heritage, his sexuality and his writing life, he searches to make sense of his spiritual longings and his physical desires.""","Plante, David",,Beacon Press,2005,,English,,,,Book,"<a href=""http://www.worldcat.org/oclc/55131479"">55131479</a>",,,,,,,,,,,,288,"Boston, Massachusetts",,,,,,"<div class=""element-text""><a href=""http://www.beacon.org/productdetails.cfm?PC=1800"">http://www.beacon.org/productdetails.cfm?PC=1800</a> <br/><br/> <a href=""http://books.google.com/books?id=HeplAAAAMAAJ&amp;q=david+plante+american+ghosts&amp;dq=david+plante+american+ghosts&amp;hl=en&amp;ei=P409Te7PFYLQgAe4kv3sCA&amp;sa=X&amp;oi=book_result&amp;ct=result&amp;resnum=1&amp;ved=0CDAQ6AEwAA"">American Ghosts @ Google Books</a></div>",,,,,https://francolibrary.com/archive/files/55fe8e932eaa6edb0a448b9613511b7b.jpg,Acculturation and Assimilation;Community: Customs and Social Life;Ethnicity and Collective Identity;Europe;Family;Fiction and Literature;Gender and Sexuality;Language and Linguistics;Personal History: Biography and Oral History;Providence RI;Religion;Youth,Biographies & Autobiographies
Wednesday's Child,"Memoir of a Franco-American woman who grew up ""down the Plains"" in Waterville, Maine. Winner of the 1997 Maine Chapbook Award. 
","Robbins, Rhea Côté",,Rheta Press,1997,,English,,,,Book,"<a href=""http://www.worldcat.org/oclc/42401388"">42401388</a>",,,,,,,,,,,,89,"Brewer, Maine",,,,,,"<div class=""element-text""><a href=""http://www.rhetapress.com/"">http://www.rhetapress.com/</a> <br/><br/> <a href=""http://books.google.com/books?id=WdoSBkk44d8C&amp;dq=robbins%3B+wednesday%27s+child&amp;source=gbs_navlinks_s"">Wednesday's Child @ Google Books</a> (limited preview available here)</div>",,,,,,Community: Customs and Social Life;Ethnicity and Collective Identity;Fiction and Literature;Gender and Sexuality;Kennebec River Valley;Language and Linguistics;Maine;Personal History: Biography and Oral History;Québec;Wallagrass ME;Waterville ME,Biographies & Autobiographies
Ten Going on Twelve,"Biography of a Franco-American girl growing up in Southern Maine at the beginning of the twentieth century. 
","Tetreau Brandt, Claire;McCune Irvine, Patricia",,iUniverse,2006,,English,,,,Book,"<a href=""http://www.worldcat.org/oclc/123028893'"">123028893</a>",,,,,,,,,,,,117,"Lincoln, Nebraska",,,9.7806E+12,,,"<div class=""element-text""><a href=""http://www.iuniverse.com/Bookstore/BookDetail.aspx?BookId=SKU-000085180"">http://www.iuniverse.com/Bookstore/BookDetail.aspx?BookId=SKU-000085180</a> <br/><br/> <a href=""http://books.google.com/books?id=uA91AAAACAAJ&amp;dq=brandt+%22ten+going+on+twelve%22&amp;hl=en&amp;ei=Im8iTJu4EMP38Abkp6G_BQ&amp;sa=X&amp;oi=book_result&amp;ct=result&amp;resnum=1&amp;ved=0CCwQ6AEwAA"">Ten Going on Twelve @ Google Books</a></div>",,,,,,Biddeford ME;Death and Disaster;Family;Food;Labor History;Language and Linguistics;Mills and Mill Work;Phillipstown ME;Saco ME;Sanford ME;Youth,Biographies & Autobiographies
It Stops with Me : Memoir of a Canuck Girl,"From Touch Art Books: ""This story with its bold contrasts of good and bad, love and hate, inextricably connected, is situated in the context of the bigger history of French Canadian and Indian people amid mainstream American culture from the mid 1950s to the edge of the 21st century....Touchette&rsquo;s story is rooted deep in the past in her parents', grandparents', and great-grandparents' experiences. Rooted in a changing, dying culture, and a community with a complex history, her mixed heritage held good and bad. With coal black eyes, Indian hair, French language, and woman-centered culture, she inherited a legacy of oppression and denial overshadowed by the powerful influence of the Catholic Church. But Touchette chose a different legacy for her children and the seven generations to follow that connected her to 5000 years of Jewish traditions, and milleniums of Native American spirituality."" Also from Touch Art Books: ""A visionary American painter examines an eventful life that spans fifty years, several cultures -- French Canadian, Indian and Jewish, and diverse places -- from Wellesley College, New York's Lower East Side, and Soho, to Indian Country, Navajo Nation and Santa Fe, New Mexico. Stories of families -- their agony and blessings, shame and pride, destruction and creation -- with brilliant illustrations, demonstrate the depth and resiliency of the human spirit, and make the personal, universal. Original.""","Touchette, Charleen",,Touch Art Books,2004,,English,,,,Book,"<a href=""http://www.worldcat.org/oclc/56615738"">56615738</a>",,,,,,,,,,,,245,"Santa Fe, New Mexico",,,9.78097E+12,,,"<div class=""element-text""><a href=""http://www.members.authorsguild.net/touchart/index.htm"">http://www.members.authorsguild.net/touchart/index.htm</a> <br/><br/> <a href=""http://oneearthblog.blogspot.com"">Charleen Touchette's blog</a> <br/><br/> <a href=""http://books.google.com/books?id=m2yHPQAACAAJ&amp;dq=touchette%3B+it+stops+with+me&amp;hl=en&amp;ei=b-VrTILjOcL78Ab-5oWgCw&amp;sa=X&amp;oi=book_result&amp;ct=result&amp;resnum=1&amp;ved=0CC8Q6AEwAA"">It Stops with Me... @ Google Books</a></div>",,,,,https://francolibrary.com/archive/files/ab3efdb65e88500ed458f85fde8ccaf3.jpg,Alcohol and Drugs;Art and Architecture;Death and Disaster;Ethnicity and Collective Identity;Family;Massachusetts;Native Americans;New Mexico;New York NY;Personal History: Biography and Oral History;Rhode Island;United States,Biographies & Autobiographies
Visions of Kerouac,"Biography of Jack Kerouac published in his hometown of Lowell, Massachusetts.  
","Jarvis, Charles E.",,Ithaca Press,1973,,English,,,,Book,"<a href=""http://www.worldcat.org/oclc/2737349"">2737349</a>","20th century, United States",,,,,,,,,,,235,"Lowell, Massachusetts",,,9.78092E+12,,,"<div class=""element-text""><a href=""http://books.google.com/books?id=Vc-vAAAAIAAJ&amp;q=jarvis%3B+visions+of+kerouac&amp;dq=jarvis%3B+visions+of+kerouac&amp;hl=en&amp;ei=iHZQTIGkOsP98Abypr3nDQ&amp;sa=X&amp;oi=book_result&amp;ct=result&amp;resnum=1&amp;ved=0CCsQ6AEwAA"">Visions of Kerouac @ Google Books</a></div>",,,,,,Alcohol and Drugs;Community: Customs and Social Life;Criticism and Review;Denver CO;Education;Lowell MA;Mexico;New York NY;Personal History: Biography and Oral History;Poetry;Religion;San Francisco CA;Social History;Sports and Leisure;St. Petersburg FL;Travel and Movement,Biographies & Autobiographies
Use My Name: Jack Kerouac's Forgotten Families,"From ECW Press: ""With this fascinating new book, Jim Jones debunks many of the myths surrounding the life and times of Jack Kerouac. Jones concentrates on those whose lives were most affected by Kerouac: daughter Jan Kerouac, wives Edie Parker, Joan Haverty, and Stella Sampas, as well as nephew Paul Blake Jr. 'Use My Name: Jack Kerouac's Forgotten Families' takes its title from advice given to Jan during her second and final meeting with Jack, who encouraged her to profit from the surname she shared with the famous author of 'On the Road.' Sadly, not one of these individuals so closely tied to Kerouac seems to have benefited from the connection, as Jones discovers in his in-depth interview with Jan. She discusses at length her 15 months as a prostitute, her own divorces, her hospitalization, and her life as an author, including a wild European book tour for [her novel] 'Baby Driver.' Although Kerouac is one of the most 'biographied' American writers of our time, Jones offers a new perspective on the King of the Beats and his generation, one in which formerly marginalized figures in the Kerouac storyparticularly womenbecome strong, central characters. He also exposes the cut-throat wheeling and dealing that has plagued the Kerouac estate and that continues today as the various players do battle over the legacy of one of the counterculture's biggest idols.""","Jones, James T.",,ECW Press,1999,,English,,,,Book,"<a href=""http://www.worldcat.org/oclc/40735081"">40735081</a>",,,,,,,,,,,,203,"Toronto, Ontario",,,9.78155E+12,,,"<div class=""element-text""><a href=""http://www.ecwpress.com/books/use_my_name"">http://www.ecwpress.com/books/use_my_name</a> <br/><br/> <a href=""http://books.google.com/books?id=9s5uS7n_6FoC&amp;source=gbs_navlinks_s"">Use My Name... @ Google Books</a> (limited preview available here)</div>",,,,,,Alcohol and Drugs;Criticism and Review;Death and Disaster;Family;Fiction and Literature;Gender and Sexuality;Illness;Literary Works -- Criticism and History;New Mexico;New York NY;Personal History: Biography and Oral History,Biographies & Autobiographies
Jack Kérouac : Essai-Poulet / A Chicken Essay,Un livre comme essai sur les rélations entre la vie et la littérature de Jack Kerouac - son écriture et son héritage - avec des réactions de l'auteur.,"Beaulieu, Victor-Lévy",,éditions du Jour,1972,,fr (en translation),,,,Book,"<a href=""http://www.worldcat.org/oclc/877702"">877702</a>;<a href=""http://www.worldcat.org/oclc/2966704"">2966704</a>",,,,,,,,,,,,235,"Montréal, Québec",,,,,,"<div class=""element-text""><a href=""http://books.google.com/books?id=IfFaAAAAMAAJ&amp;q=levy-beaulieu;+kerouac&amp;dq=levy-beaulieu;+kerouac&amp;hl=en&amp;ei=N41ATe7ILsKclge40sHtAg&amp;sa=X&amp;oi=book_result&amp;ct=result&amp;resnum=1&amp;ved=0CCcQ6AEwAA"">Jack Kerouac: A Chicken-Essay @ Google Books</a></div>",,,,,https://francolibrary.com/archive/files/c342dab488b33e6d179d019a4749be51.jpg,Alcohol and Drugs;Essay;Family;Gender and Sexuality;Language and Linguistics;Literary Works -- Criticism and History;Lowell MA;Mexico;Personal History: Biography and Oral History;Québec;San Francisco CA;St. Petersburg FL,Biographies & Autobiographies
I Had a Father: A Post-Modern Autobiography,"From Library Journal: ""This unusual memoir focuses on the author's attempt to understand his dead father. Blaise, a prize-winning novelist and director of the University of Iowa's International Writing Program, combines fragments of memories, mostly concerned with locations, as he circles around the story of his difficult, much-married father, a French Canadian/American traveling salesman."" ","Blaise, Clark",,Addison-Wesley,1993,,English,,,,Book,"<a href=""http://www.worldcat.org/oclc/26398865"">26398865</a>",,,,,,,,,,,,204,"Reading, Massachusetts",,,9.7802E+12,,,"<div class=""element-text""><a href=""http://books.google.com/books?id=1j9aAAAAMAAJ&amp;q=i+had+a+father%3B+blaise&amp;dq=i+had+a+father%3B+blaise&amp;hl=en&amp;ei=f-FJTOWmJYL_8AaN6L2uDg&amp;sa=X&amp;oi=book_result&amp;ct=result&amp;resnum=1&amp;ved=0CC4Q6AEwAA"">I Had a Father... @ Google Books</a></div>",,,,,,Alcohol and Drugs;Canada;Death and Disaster;Family;Personal History: Biography and Oral History;Travel and Movement;United States,Biographies & Autobiographies
Little Canuck : The Adventures of an Immigrant Boy from Québec,"Self-published memoir about life in Québec, and life after Québec. From iUniverse: ""Michel learns that his father is dying. This news precipitates a nostalgic journey into the past-a childhood spent on a dairy farm in French Québec. As a sensitive boy secluded from the world, Michel wavers between forbidden exploits and heartbreaking tribulations. Catholic school is a culture shock, but it's the huge pumpkin-shaped teacher with a bad temper who terrorizes his brain most. On the farm, his young life abounds with fun and danger-mad bulls, dynamite sticks, runaway darts, lethal ice cubes, and hazardous farm equipment. After struggling with a dismal economy, his family is forced to abandon their home. They desert their isolated farmhouse and move into a cockroach-infested apartment in an English-speaking city one mile from the seductive United States border. There, Michel copes with bullies, Russian spies, and ghosts. 'Little Canuck' recounts the humorous, and at times, heartrending memoirs of a young boy on his journey through a colorful landscape of emotion. Along the way, young Michel uncovers the mysteries of female anatomy, and learns poignant truths about mortality. His most profound lessons are not learned at school.
","Blanchette, Michel A.",,iUniverse,2005,,English,,,,Book,"<a href=""http://www.worldcat.org/oclc/67294624"">67294624</a>",,,,,,,,,,,,282,"Lincoln, Nebraska",,,9.7806E+12,,,"<div class=""element-text""><a href=""http://www.iuniverse.com/Bookstore/BookDetail.aspx?BookId=SKU-000082653"">http://www.iuniverse.com/Bookstore/BookDetail.aspx?BookId=SKU-000082653</a> <br/><br/> <a href=""http://books.google.com/books?id=BgioADwbn_QC"">Little Canuck... @ Google Books</a> (limited preview available)</div>",,,,,,Canada;Community: Customs and Social Life;Death and Disaster;Education;Emigration and Immigration;Family;Farming and Agriculture;Folklore;Gender and Sexuality;Government and Politics;Illness;Personal History: Biography and Oral History;Québec;Religion,Biographies & Autobiographies
As I Live and Dream,"Autobiographical collection of essays that chronicle a Franco American's family life in western Maine in the first half of the twentieth century. Includes one chapter on the history of Rumford, Maine. ","Coté, Gertrude M.",,Self-published,1953,,English,,,,Book,"<a href=""http://www.worldcat.org/oclc/8811829"">8811829</a>","1900-1953, Maine",,,,,,,,,,,221,"Manchester, Maine",,,,,,"<div class=""element-text""><a href=""http://books.google.com/books?id=t532HAAACAAJ&amp;dq=as+I+live+and+dream%3B+cote&amp;cd=1"">As I Live and Dream @ Google Books</a></div>",,,,,,Community: Customs and Social Life;Essay;Family;Food;Language and Linguistics;Madison ME;Mexico ME;Personal History: Biography and Oral History;Québec;Religion;Rumford ME;Vermont;Youth,Biographies & Autobiographies
My Life on the Line : Recollections of a Childhood Spent in the Maine-New Brunswick Border Country during the Great Depression,"Memoirs of a Northern Maine woman growing up during the Great Depression, with family straddling the rural and agrarian borderland of Maine and New Brunswick. Memories of her great-grandmother and extended family from working on a New Brunswick farm in the summers of her youth. The tensions between her French Canadian Catholicism and the Presbyterianism of her New Brunswick relatives. Memories of her family and life in Island Falls, Maine. Parts of her search for her French lineage. Illustrated in black and white photograph.","Stratton, Frances Morin Webb",,Self-published,1985,"Stratton, Richard E.",en,,,,Book,"<a href=""http://www.worldcat.org/oclc/24660801"">24660801</a>","20th century; St. John River Valley, Maine; New Brunswick",,,,,,,,,,,123,"Old Town, Maine",Self-Published,,,,,"<div class=""element-text""><a href=""http://books.google.com/books?id=sR9hGwAACAAJ"">My Life on the Line...</a> @ Google Books</div>",,,,,https://francolibrary.com/archive/files/ad25473bd34693c61f79acea187ee6d0.jpg,Aroostook County ME;Business and Economics;Caribou ME;Family;Farming and Agriculture;Houlton ME;Island Falls ME;New Brunswick;Nonfiction;Nonfiction -- History -- Local;Personal History: Biography and Oral History;Religion;Sheridan ME;Sports and Leisure;St. John River Valley,Biographies & Autobiographies
"Ferdinand Gagnon : Biographie, éloge funeèbre, pages choisies","Des écritures et un oraison funièbre d'un homme treès significatif au mouvement survivance aux Etats-Unis, un fondateur de la presse franco-américaine dans la Nouvelle Angleterre au dix-neuviième sieècle, et rédacteur ancien de la publication, Le Travailleur. Contient une briève introduction biographique écrit par Josephat Benoit.","Martineau, Malvina-E. ",Texte intégral,Self-published,1940,,Français,,,,Book,"<a href=""http://www.worldcat.org/oclc/36552011"">36552011</a>","19e siiècle, Worcester, Massachusetts, Nouvelle-Angleterre",,,,,,,,,,,279,,Auto-édité,,,,,"<div class=""element-text""><a href=""http://babel.hathitrust.org/cgi/pt?id=mdp.39015063700192;q1=ferdinand%20gagnon"">Ferdinand Gagnon @ HathiTrust Digital Library</a> (disponible pour lire ici)</div>;<div class=""element-text""><a href=""http://books.google.com/books?id=5bFqPwAACAAJ&amp;dq=ferdinand+gagnon+biographie&amp;hl=en&amp;ei=8IfITNaKLsL78AbdqpAr&amp;sa=X&amp;oi=book_result&amp;ct=result&amp;resnum=4&amp;ved=0CDgQ6AEwAw"">Ferdinand Gagnon... sur Google Books</a></div>",,,,,https://francolibrary.com/archive/files/7e5433d60ce44a8e34d647e4454401f3.jpg,Acculturation and Assimilation;Burlington VT;Champlain NY;Community: Customs and Social Life;Concord NH;Essay;Ethnicity and Collective Identity;Fall River MA;Journalism;Language and Linguistics;Lewiston ME;Lowell MA;Maine;Manchester NH;Massachusetts;Montréal QC;New England;New Hampshire;Providence RI;Québec;Southbridge MA;Vermont;Woonsocket RI;Worcester MA,Biographies & Autobiographies
Prairie Roses : La Petite Soeur Tells About Her Family,"Memoirs spanning the period from 1901 to 1945, focusing on stories of the author's family throughout the midwestern United States during that period.","Corey, Eleanor Lemire",,Self-published,2001,,English,,,,Book,"<a href=""http://www.worldcat.org/oclc/50562148"">50562148</a>","1901-1945, US Midwest",,,,,,,,,,,43,"Cottage Grove, Oregon",Self-published,,,,,,,,,,,Family;Farming and Agriculture;France;Minnesota;Mississippi River Valley;North Dakota;Oregon;Personal History: Biography and Oral History;Québec;Religion;Wisconsin,Biographies & Autobiographies
"Destination Madawaska : Biographie de Charles Terrieau, pionnier acadien ","From the author: ""The book is a biography of Charles Theriault, first francophone settler in 1821-1823 of the lower Madawaska River in present-day St-Jacques. The book presents a brief history of the Acadian migration before the time of Charles' trail-blazing in the wilderness of the Madawaska territory. The territory at that time was a no-man's land' that included much of northern Maine from Houlton and all of Madawaska county and parts of Victoria and Restigouche counties of northwestern New Brunswick. At that time, the territory was claimed by the United States as being part of the new state of Maine and was also claimed by England as being part of the new colony of New Brunswick. The dispute was settled by the Webster-Ashburton Treaty of 1842 which  chose the St-John River as the international boundary separating the United States and New Brunswick. The book presents the genealogy of the greater Thériault family in the St-John Valley showing that the population of all Thériaults until 1900 came from three branches of the Acadian family; one which migrated from the lower St-John to St-Basile around 1790 and two branches which had migrated from Acadia to Kamouraska, QC in 1759 and later migrated to the various Madawaska settlements between 1820 and 1860.""","Thériault, J.R.T. ",,Société Historique du Madawaska,2009,,Bilingual/bilingue,,,,Book,,"17th century - 19th century, New Brunswick",,,,,,Bilingual/bilingue,,,,,111,"Edmundston, New Brunswick",,,,,,"<div class=""element-text""><a href=""http://www.terriau.org/news.htm"">http://www.terriau.org/news.htm</a></div>",,,,,https://francolibrary.com/archive/files/f698d824fc871587e3902ebdb198303a.jpg,Acadians;Emigration and Immigration;Family;Genealogy;Government and Politics;Houlton ME;Madawaska ME;New Brunswick;Nova Scotia;Personal History: Biography and Oral History;St. John ME,Biographies & Autobiographies
