title,description,creator,source,publisher,date,contributor,language,rights,relation,format,type1,identifier,coverage,zotero_genre,zotero_distributor,zotero_director,z_performer,zotero_episode_number,zotero_language,zotero_network,zotero_audio_recording_format,zotero_label,zotero_running_time,zotero_num_pages,zotero_place,zotero_publisher,zotero_issn,zotero_isbn,zotero_issue,zotero_publication_title,z_url,zotero_volume,zotero_short_title,z_ref,type2,files,tags,collection
Girls of Tender Age : A Memoir,"Memoir of a woman growing up in the immigrant city of Hartford, Connecticut in the 1950s. Her French Canadian and Italian relatives, her childhood, early adulthood, and the processes of recollecting them. Divided into five parts: Mortality; Brain Jog; the Quest; What Goes Around...; The Future Is Now; followed by notes and acknowledgements. Alternates between stories from the life of the author, her friends and relatives, and the murder of a childhood friend by a Hartford serial child abuser named Robert Malm. The author's efforts at retelling the story of Malm's life, trial, and Connecticut execution, and their intersection with her life.","Tirone Smith, Mary-Ann",Read: Preview,Free Press,2006,,English,,,,Book,"<a href=""http://www.worldcat.org/oclc/61151630"">61151630</a>;<a href=""http://www.worldcat.org/oclc/71541743"">71541743</a>","1950s; Hartford, Connecticut",,,,,,,,,,,285,"New York, New York",Free Press,,9.78074E+12,,,"<div class=""element-text""><a href=""http://books.google.com/books?id=usJBbGyEGokC&amp;source=gbs_navlinks_s"">Girls of Tender Age... @ Google Books</a></div>",,,,,https://francolibrary.com/archive/files/f0dcfea2fc5e7682a48af508c6fde7f3.jpg,Community: Customs and Social Life;Connecticut;Death and Disaster;Emigration and Immigration;Family;Gender and Sexuality;Hartford CT;Irish Americans;Italian Americans;Italy;Language and Linguistics;Personal History: Biography and Oral History;Polish Americans;Québec;Religion;Vermont;Violence;Youth,Biographies & Autobiographies
My Time Is Your Time : The Story of Rudy Vallee,"Memoirs of twentieth-century singer and musician, Rudy Vallée. Co-authored. Stories from his early life in Westbrook, Maine, and his college years in New Haven, Connecticut. Events along his rise to stardom, and the varieties of entertainment he participated in while in the public eye.","Vallée, Rudy;McKean, Gil",,"Ivan Obolensky, Inc.",1962,,English,,,,Book,"<a href=""http://www.worldcat.org/oclc/488031"">488031</a>",20th century; United States,,,,,,,,,,,244,"New York, New York","Ivan Obolensky, Inc.",,,,,"<div class=""element-text""><a href=""http://books.google.com/books/about/My_Time_Is_Your_Time.html?id=XuwETwEACAAJ"">My Time Is Your Time @ Google Books</a></div>",,,,,https://francolibrary.com/archive/files/82285c7f9393369cd7b5103e2ae8ca55.jpg,Los Angeles CA;Maine;Music;New York NY;Old Orchard Beach ME;Personal History: Biography and Oral History;Rumford Falls ME;Westbrook ME,Biographies & Autobiographies
Vagabond Dreams Come True,"Original autobiography of twentieth-century singer and musician, Rudy Vallée, who was born in Island Pond, Vermont and spent his youth in Westbrook, Maine. His early life, time at the University of Maine and Yale University, and his early music career. His travels and successes, and some of his thoughts on fame.","Vallée, Rudy",Excerpts,"E.P. Dutton & Co., Inc.",1930,,en,,,,Book,"<a href=""http://www.worldcat.org/oclc/910206"">910206</a>",20th century; United States,,,,,,,,,,,262,"New York, New York","E.P. Dutton & Co., Inc.",,,,,"<div class=""element-text""><a href=""http://books.google.com/books/about/Vagabond_dreams_come_true.html?id=RYg4AAAAIAAJ"">Vagabond Dreams Come True @ Google Books</a></div>",,,,,https://francolibrary.com/archive/files/d71b70dd453a963f19ceac7cf180de99.jpg,Family;Island Pond VT;Los Angeles CA;Maine;Music;New Haven CT;New York NY;Orono ME;Personal History: Biography and Oral History;Rumford Falls ME;Westbrook ME;Youth,Biographies & Autobiographies
Brothers and Heroes : A Chronicle of Military Service of Six Americans,"Military stories and individual histories of the military duties of six Augusta, Maine brothers - Armand, Laurent, Paul, Jean, William, and Louis Lambert. Written by the family's youngest son, George.  Narrative covers enlistment periods and active duty between 1941 and 1988. Appendices contain diary entries, court proceedings, individual chronologies of service, individual stations of duty, photographs, bibliography, and other information.","Lambert, George J.",,"PublishAmerica, Inc.",2008,,English,,,,Book,,"1941-2008; Augusta, Maine",,,,,,,,,,,162,"Baltimore, Maryland","PublishAmerica, Inc.",,9.78145E+12,,,"<div class=""element-text""><a href=""http://www.publishamerica.net/product22336.html"">http://www.publishamerica.net/product22336.html</a></div>",,,,,https://francolibrary.com/archive/files/19c174e26aaf7953ea0399ee91eb99fb.jpg,Augusta ME;Death and Disaster;Family;Personal History: Biography and Oral History;War,Biographies & Autobiographies
Poetry and the Landscape of Epiphany,"Short autobiographical essay on the elements of cultural heritage evident in the author's family history and youth; the persistence of a French Canadian ""communal sensuous self,"" the impact of one's environments, and recognizing one's heritage beneath evolving shapes of assimilation in America. Includes a translation of Anne Hébert's ""Castle Life."" Republished in ""The Maine Reader: The Down East Experience from 1614 to the Present,"" with a brief introduction to Maine Franco American history, local photographs, and the poem, ""To My Brother.""","Poulin, A., Jr.",,BOA Editions,1987,,Section: English;Book: English et français,,,,Book Section,"<a href=""http://www.worldcat.org/oclc/18323269"">18323269</a>;<a href=""http://www.worldcat.org/oclc/31174604"">31174604</a>",20th century; Maine,,,,,,,,,,,,"Brockport, New York",BOA Editions,,9.78092E+12,,,"<div class=""element-text""><a href=""http://books.google.com/books?id=KLNcAAAAMAAJ"">Anne Hébert: Selected Poems @ Google Books</a></div>;<div class=""element-text""><a href=""http://books.google.com/books?id=LB6jYtB3vlIC&amp;source=gbs_navlinks_s"">The Maine Reader: The Down East Experience... @ Google Books</a></div>",,,,,https://francolibrary.com/archive/files/6c3e8e648cc76081c1e863250dacd1ae.jpg,Acculturation and Assimilation;Biddeford ME;Essay;Ethnicity and Collective Identity;Family;Lewiston ME;Lisbon ME;Lowell MA;Mills and Mill Work;Poetry;Religion;Youth,Biographies & Autobiographies
Hello to Springtime,"Memoirs of the author's youth as an American transplant in Ottawa, under the quirks and guise of his fainthearted mother and musician father. Childhood, schooling, religion, and observations on family life in Ontario during the era of the first World War.","Fontaine, Robert Louis",,Crowell,1955,,English,,,,Book,"<a href=""http://www.worldcat.org/oclc/1497420"">1497420</a>","1910-1955; Ottawa, Ontario",,,,,,,,,,,246,"New York, New York",Crowell,,,,,"<div class=""element-text""><a href=""http://books.google.com/books?id=6JpAAAAAIAAJ"">Hello to Springtime... @ Google Books</a></div>",,,,,,Canada;Family;Marlboro MA;Music;Ontario;Religion;Travel and Movement;War;Youth,Biographies & Autobiographies
My Last Million Readers,"Autobiography of famed newspaperman, Emile Gavreau. His youth in the first decade of the twentieth century in New Haven, Connecticut, and among family in Montréal. A family's pervasive Catholicism; an early attachment to reading; intimate portraits of his father. His early work for the New Haven Journal-Courrier, later for the Hartford Courantaround the time of World War I, and at the beginning of the New York Daily Graphic.","Gauvreau, Emile",PREVIEW,E. P. Dutton and Company,1941,,English,,,,Book,"<a href=""http://www.worldcat.org/oclc/334962"">334962</a>","Early 20th century; New Haven and Hartford, Connecticut; New York, New York",,,,,,,,,,,488,"New York, New York",E. P. Dutton and Company,,,,,"<div class=""element-text""><a href=""http://books.google.com/books?id=enJ_Z9yujL4C&amp;lpg=PP1&amp;pg=PP1#v=onepage&amp;q&amp;f=false"">My Last Million Readers</a> @ Google Books</div>",,,,,https://francolibrary.com/archive/files/32238e65883a2260f23296e7e46d0a06.jpg,Canada;Connecticut;Family;Government and Politics;Hartford CT;Health and Wellness;Journalism;New Haven CT;New York NY;Personal History: Biography and Oral History;Religion,Biographies & Autobiographies
"When We Were the Kennedys : A Memoir from Mexico, Maine","Memoir from Mexico, Maine native and author of fiction, Monica Wood. Recalls the period of the author's youth around the time of the sudden death of her father. Her family's experience of the loss of its breadwinner in the 1960s. The shape of her 1963 mill-centered community and the diversity of people who inhabited it; portraits of the power of religion and industry among people in the towns of Rumford and Mexico. President John F. Kennedy's 1963 assassination - and the widowhood of Jacqueline Kennedy Onassis - recounted in light of the disruptive passing of the author's father earlier that same year.","Wood, Monica",Preview,Houghton Mifflin Harcourt,2012,,en,,,,Book,"<a href=""http://www.worldcat.org/oclc/719673406"">719673406</a>","1963-1964; Mexico, Maine",,,,,,en,,,,,235,"Boston, Massachusetts",Houghton Mifflin Harcourt,,9780547630144 : 054763014X,,,"<div class=""element-text""><a href=""http://www.monicawood.com"">http://www.monicawood.com</a></div>",,,,,https://francolibrary.com/archive/files/c27b101982bd03c4646d9bf6d5b21044.JPG,Community: Customs and Social Life;Death and Disaster;Family;Irish Americans;Italian Americans;Lithuanian Americans;Mexico ME;Mills and Mill Work;Personal History: Biography and Oral History;Religion;Rumford ME;Washington DC;Youth,Biographies & Autobiographies
Memory Babe : A Critical Biography of Jack Kerouac,"Biography of Lowell, Massachusetts native, poet, and author, Jack Kerouac, widely known as a founding participant in the 20th century USA literary culture that came to be called the ""Beat Movement,"" or the ""Beat Generation."" Kerouac's life from birth to early death; from Lowell, to New York, to San Francisco, to Denver, to Tampa and St. Petersburg, and back again. The cultural, interpersonal, and geographic contexts for his poetry and writings of autobiographical fiction. Anecdotes and aspects of his public and private lives, and where these lives changed and converged. Well-known for the biographer's extensive use of archival materials and interviews with Kerouac's contemporaries.","Nicosia, Gerald",,Grove Press,1983-00-00,,en,,,,Book,"<a href=""http://www.worldcat.org/oclc/9392871"">9392871</a>","20th century; Lowell, Massachusetts; United States",,,,,,,,,,,767,"New York, New York",Grove Press,,0394522702 9780394522708,,,"<div class=""element-text""><a href=""http://books.google.com/books?isbn=0520085698"">Memory Babe...</a> @ Google Books</div>",,,,,https://francolibrary.com/archive/files/256a44585bb73ccb59410554c0a9022e.jpg,Alcohol and Drugs;Criticism and Review;Death and Disaster;Denver CO;Family;Fiction and Literature;Lowell MA;Nashua NH;New York NY;Northport NY;Personal History: Biography and Oral History;Poetry;San Francisco CA;St. Petersburg FL;Travel and Movement;Youth,Biographies & Autobiographies
Journal d'un bibliophile,"Témoignage autobiographique d'un homme à  Manchester, New Hampshire et sa relation avec les livres. Son accumulation à  vie de milles de livres de ""Canadiana"" et ""Franco-Americana,"" et les histoires qui l'accompagnent, vers leur lieu de repos à  l'Association Canado-Américaine. Sa vie comme collectionneur de livres. Comprend aussi des lettres et des articles de journaux relatifs à  la Collection Lambert. Note: La Collection Lambert réside maintenant à  Saint Anselm College à  Manchester, New Hampshire.","Lambert, Adélard",,"Imprimerie La Parole, Limitée",1927-00-00,,fr,,,,Book,"<a href=""http://www.worldcat.org/oclc/6156497"">6156497</a>","ca. 1900-1927; Manchester, New Hampshire",,,,,,fr,,,,,142,"Drummondville, Québec","Imprimerie La Parole, Limitée",,,,,"<div class=""element-text""><a href=""books.google.com/books?id=prEXAAAAMAAJ"">Journal d'un bibliophile...</a> sur Google Books</div>",,,,,https://francolibrary.com/archive/files/c7dcfda1c236ed961da97bdf5de65f86.jpg,Champlain NY;Clubs and Societies;Emigration and Immigration;Fall River MA;Journalism;Manchester NH;New England;New Hampshire;Personal History: Biography and Oral History;Québec;Woonsocket RI;Worcester MA,Biographies & Autobiographies
Becoming a Man : Half a Life Story,"Autobiography and coming-out narrative of Paul Monette, an Andover, Massachusetts writer. Monette recounts twenty-five closeted years of alienation and invisibility, explorations of his sexual identity, and observations on the sexual prejudice and violences around him. Growing up working-class in Massachusetts; his ill younger brother; stints at prep-school and Yale in the 1960s; time spent in England; a return to Massachusetts. Written during the battle with AIDS that eventually claimed the author's life. Winner of the 1992 National Book Award for Nonfiction. Republished in 2004.","Monette, Paul",,Harcourt Brace Jovanovich,1992,,en,,,,Book,"<a href=""http://www.worldcat.org/oclc/24872593"">24872593</a>","20th century; Andover, Massachusetts",,,,,,,,,,,278,"New York, New York",Harcourt Brace Jovanovich,,0151115192 9780151115198,,,"<div class=""element-text""><a href=""http://books.google.com/books?id=huHZAAAAMAAJ"">Becoming a Man...</a> @ Google Books</div>;<div class=""element-text""><a href=""http://books.google.com/books?isbn=0060595647"">Becoming a Man...</a> @ Google Books</div>",,,,,https://francolibrary.com/archive/files/7e7e96e7d91b2972c1439dfba0bbaddc.jpg,Andover MA;Boston MA;Death and Disaster;Family;Gender and Sexuality;Illness;Lawrence MA;Massachusetts;Merrimack River Valley;New Haven CT;Personal History: Biography and Oral History;Religion;Violence;Youth,Biographies & Autobiographies
Holeb : The Way I Remember It,"Memoir compiled from early twentieth-century stories of the author's youth, growing up in a large Canadian immigrant family in the townships of Brassua and Holeb, Somerset County, Maine. Rural family life in northwestern Maine - sporting, housing, schooling, work, and community.","Grenier, Ross L.",,Monkey Publishing,2010,,en,,,,Book,,"20th century; Holeb, Maine",,,,,,,,,,,128,"Caribou, Maine",Monkey Publishing,,,,,,,,,,https://francolibrary.com/archive/files/8e0723a649285424b3e2d097744c3aab.jpg,Brassua (Me?);Emigration and Immigration;Family;Farming and Agriculture;Forestry;Greenville ME;Holeb ME;Jackman ME;Long Pond ME;Maine;Moose River Valley;Québec;Religion;Waterville ME;Youth,Biographies & Autobiographies
The Voice Is All : The Lonely Victory of Jack Kerouac,"Biographical portrait of Jack Kerouac, with uniquely heavy emphasis on the suggested influence of his French Canadian heritage - and the French language - on the style and content of his creative works. Written by a Kerouac contemporary and former friend. Covers from Kerouac's early life and those of his parents, to 1951, shortly after the publication of his first novel, The Town and the City.","Johnson, Joyce",Preview,Viking,2012,,en,,,,Book,"<a href=""http://www.worldcat.org/oclc/774147822"">774147822</a>","1900-1951; New York, New York; United States",,,,,,en,,,,,489,"New York, New York",Viking,,9.78067E+12,,,"<div class=""element-text""><a href=""http://books.google.com/books?isbn=110160106X"">The Voice Is All...</a> @ Google Books</div>;<div class=""element-text""><a href=""http://www.joycejohnsonbooks.net"">http://www.joycejohnsonbooks.net</a></div>",,,,,https://francolibrary.com/archive/files/4f39825b496fbf5c5a26289d5d30f7b6.jpg,Alcohol and Drugs;Ethnicity and Collective Identity;Literary Works -- Criticism and History;Lowell MA;New York NY;Personal History: Biography and Oral History;Québec;San Francisco CA,Biographies & Autobiographies
Bird Cloud : A Memoir,"Narrative of the discovery and inhabiting of the author's homestead along Wyoming's North Platte River. Memoirs from the author's youth and family life, relatives, their cultures and their mobility. Her youth across New England. Historical, archaeological, and genealogical portraits of her family, her various regions, and their people woven throughout. Vivid descriptions of natural life in the rural United States that add to several chapters on the processes of architecting, building, and getting acquainted with her Wyoming home - Bird Cloud - and its own histories. From the author of ""The Shipping News,"" ""Accordion Crimes,"" and several other notable works of fiction.","Proulx, Annie",Preview,Scribner,2011,,en,,,,Book,"<a href=""http://www.worldcat.org/oclc/555641609"">555641609</a>",17th century-21st century; Wyoming; United States,,,,,,en,,,,,234,"New York, New York",Scribner,,0743288807 9780743288804,,,"<div class=""element-text""><a href=""http://books.google.com/books?isbn=0743288815"">Bird Cloud...</a> @ Google Books</div>",,,,,https://francolibrary.com/archive/files/2e7a4a0e063f8805aa53a9450ec0dcf7.jpg,Acculturation and Assimilation;Art and Architecture;Connecticut;Ethnicity and Collective Identity;Family;Genealogy;Geography;Maine;Montréal QC;New Hampshire;North Carolina;Personal History: Biography and Oral History;Rhode Island;Saratoga WY;Travel and Movement;Vermont;Willimantic CT;Wyoming,Biographies & Autobiographies
"Spoons' Spoons : The Life and Times of Theodore Edouard ""Spoons"" Michaud","Biography of Eddie ""Spoons"" Michaud, renowned musician from Old Town, Maine. Stories of his life, times, family, and friends from 1923 to the present.  Includes black and white photographs of Michaud throughout his life, both with and without his namesake instrument - the spoons - as well as select representations of maps of Maine towns.","Michaud, Theodore Edouard;Wing, Charles J.",,Self-published,2012,,en,,,,Book,,"20th century; Old Town, Maine",,,,,,,,,,,119,"Old Town, Maine",Self-published,,,,,,,,,,,Biography;French Island ME;Maine;Music;Nonfiction -- History -- Local;Old Town ME;Personal History: Biography and Oral History,Biographies & Autobiographies
"Inside, Looking Out","Memoir of famed television soap opera writer and playwright, Harding Lemay. From his tumultuous early youth - one of thirteen children - on a New York farm along the Canadian border, to his lonely escape to New York City at the age of 17 and the friends who find him there. His later military training and participation in World War II in Europe. Back to Manhattan to one failed and one successful marriage, and to live and work among books: in libraries, with publishing executives, and finally as a writer. His persistent love of books and struggles with language.","Lemay, Harding",,Harper & Row,1971,,en,,,,Book,"<a href=""http://www.worldcat.org/oclc/136962"">136962</a>",1922-1971; New York,,,,,,,,,,,273,"New York, New York",Harper & Row,,,,,"<div class=""element-text""><a href=""http://books.google.com/books?id=U3cnAAAAMAAJ"">http://books.google.com/books?id=U3cnAAAAMAAJ</a></div>",,,,,https://francolibrary.com/archive/files/df7ce055c46321938f60c48452ca1378.jpg,Detroit MI;Fall River MA;Family;Film and Television;Maine;Massachusetts;Mohawk;New York;North Bangor NY;Personal History: Biography and Oral History;Providence RI;Religion;Violence;Worcester MA;Youth,Biographies & Autobiographies
