title,description,creator,source,publisher,date,contributor,language,rights,relation,format,type1,identifier,coverage,zotero_genre,zotero_distributor,zotero_director,z_performer,zotero_episode_number,zotero_language,zotero_network,zotero_audio_recording_format,zotero_label,zotero_running_time,zotero_num_pages,zotero_place,zotero_publisher,zotero_issn,zotero_isbn,zotero_issue,zotero_publication_title,z_url,zotero_volume,zotero_short_title,z_ref,type2,files,tags,collection
"Franco Marriages from Goffstown, New Hampshire: 1893-1992","One hundred years of Catholic marriages from the Goffstown, New Hampshire, region. Includes marriages from St. Lawrence and St. Edmond parishes.","Boudreau, Arthur;Perrault, Anne-Marie;American-Canadian Genealogical Society",,,2000,,,,,,Book,"<a href=""http://www.worldcat.org/oclc/53813496"">53813496</a>","1893-1992, Goffstown, New Hampshire",,,,,,,,,,,276,"Manchester, New Hampshire",American-Canadian Genealogical Society,,,,,"<div class=""element-text""><a href=""http://www.acgs.org"">http://www.acgs.org</a></div>",,,,,,Community: Customs and Social Life;Family;Genealogy;Goffstown NH;Manchester NH;Religion,Genealogy | Généalogie
An Elaborate History and Genealogy of the Ballous in America,"Subtitled: ""Carefully Compiled and Edited by Adin Ballou; with Numerous Artistic Illustrations."" Massive family history of the Ballou family of Rhode Island. Written at the end of the 19th century.","Ballou, Adin",,,1888,,,,,,Genealogy,"<a href=""http://www.worldcat.org/oclc/44956605"">44956605</a>","1650-1888, Rhode Island",,,,,,,,,,,1323,"Providence, Rhode Island",Press of E.L. Freeman & Son,,,,,"<div class=""element-text""><a href=""http://books.google.com/books?id=csc6AAAAMAAJ&amp;printsec=frontcover&amp;dq=ballou,+adin%3B+an+elaborate+history&amp;hl=en&amp;ei=U2JETOPWGsG88gaire2bDw&amp;sa=X&amp;oi=book_result&amp;ct=result&amp;resnum=1&amp;ved=0CCgQ6AEwAA#v=onepage&amp;q&amp;f=false"">An Elaborate History of the Ballous in America @ Google Books</a> (full text available)</div>",,,,,,Family;Genealogy;Personal History: Biography and Oral History;Providence RI;Rhode Island,Genealogy | Généalogie
Beginning Franco-American Genealogy,"First edition published in 1986. A guide to conducting one's own genealogy, with resources appropriate for those with Franco American and Canadian French ancestry.","Boudreau, Dennis M.",,,1993,,,,,,Genealogy,"<a href=""http://www.worldcat.org/oclc/33086650"">33086650</a>",,,,,,,,,,,,75,"Pawtucket, Rhode Island",American French Genealogical Society,,,,,"<div class=""element-text""><a href=""http://books.google.com/books?id=0P4_OwAACAAJ&amp;dq=beginning+franco-american+genealogy&amp;hl=en&amp;ei=1kJLTOmDLsP-8Aaeut0z&amp;sa=X&amp;oi=book_result&amp;ct=result&amp;resnum=1&amp;ved=0CDIQ6AEwAA"">Beginning Franco-American Genealogy @ Google Books</a></div>",,,,,,Family;Genealogy;Rhode Island,Genealogy | Généalogie
"French and Native North American Marriages, 1600-1800",List of French (Canadian) and Native American Marriages from eastern North America. Respective sources are listed for each documented marriage.,"Bunnell, Paul",,,2004,,,,,,Genealogy,"<a href=""http://www.worldcat.org/oclc/58017168"">58017168</a>","1600-1800, Canada, United States",,,,,,,,,,,161,"Westminster, Maryland",Heritage Books,,9.78079E+12,,,"<div class=""element-text""><a href=""http://heritagebooks.com/mm5/merchant.mvc?Screen=PROD&amp;Store_Code=HBI&amp;Product_Code=B2595&amp;Category_Code="">http://heritagebooks.com/mm5/merchant.mvc?Screen=PROD&amp;Store_Code=HBI&amp;Product_Code=B2595&amp;Category_Code=</a> <br/> <br/> <a href=""http://books.google.com/books?id=raLuLe7M2TcC&amp;printsec=frontcover&amp;dq=bunnell,+french+and+native+north+american+marriages&amp;source=bl&amp;ots=v0XznOwOS7&amp;sig=Ye14YHTeB_vRHkdtVI2PrvEk9W0&amp;hl=en&amp;ei=UbEjTMzvCoO88ga55KC5BQ&amp;sa=X&amp;oi=book_result&amp;ct=result&amp;resnum=1&amp;ved=0CBUQ6AEwAA#v=onepage&amp;q&amp;f=false"">French and Native North American Marriages @ Google Books</a> (limited preview)</div>",,,,,,Acadians;Canada;Ethnicity and Collective Identity;Genealogy;Native Americans;New England;United States,Genealogy | Généalogie
Histoire de ma famille,"A blank, illustrated text and family tree (with some commentary) to be filled-in with one's own genealogy.","Campagna, Dominique",,,1960,,,,,,Book,"<a href=""http://www.worldcat.org/oclc/3271013"">3271013</a>",,,,,,,,,,,,84,"Cap-Rouge, Québec",Self-published,,,,,"<div class=""element-text""><a href=""http://books.google.com/books?id=TicFHQAACAAJ&amp;dq=%22campagna%22%3B+histoire+de+ma+famille&amp;hl=en&amp;ei=rBFOTIvfJoH_8AaEhJX8Cw&amp;sa=X&amp;oi=book_result&amp;ct=result&amp;resnum=1&amp;ved=0CCgQ6AEwAA"">Histoire de ma famille @ Google Books</a></div>",,,,,,Education;Genealogy;Youth,Genealogy | Généalogie
The First French Canadians: Pioneers in the St. Lawrence Valley,"From University of Delaware Press: ""This book is the culmination of an enormous project aimed at the identification of the original French migrants to Québec and their descendants in the form of a computerized population register.""","Charbonneau, Hubert;Desjardins, Bertrand;Guillemette, André;Landry, Yves;Légaré, Jacques;Nault, Francois",,,1993,,,,,,Genealogy,"<a href=""http://www.worldcat.org/oclc/27108728"">27108728</a>","1600s, France, Québec",,,,,,,,,,,252,"Cranbury, New Jersey",University of Delaware Press,,9.78087E+12,,,"<div class=""element-text""><a href=""http://www2.lib.udel.edu/udpress/ftitles.htm#0-87413-454-4"">http://www2.lib.udel.edu/udpress/ftitles.htm#0-87413-454-4</a> <br/> <br/> <a href=""http://www2.lib.udel.edu/udpress/ftitles.htm#0-87413-454-4"">The First French Canadians @ Google Books</a> (limited preview available)</div>",,,,,,Community: Customs and Social Life;Demography;Emigration and Immigration;Ethnicity and Collective Identity;France;Genealogy;Geography;Government and Politics;Montréal QC;Québec;St. Lawrence River Valley,Genealogy | Généalogie
"Marriages of St. Joseph's Catholic Church, Old Town, Maine (1860-1960): Including 1836-1892 Franco-American marriages recorded in the civil registers of Bangor, Bradley, Brewer, Old Town, and Orono","A list of marriages from 1836 to 1892, a list of priests, marriages, and marriage extracts from 1862 to 1960, a necrology from 1880-1946, a list of Anglicized French surnames in the Old Town area, and a list of the earliest French-Canadian families in Old Town.","Chenard, Robert",,,1993,,,,,,Genealogy,"<a href=""http://www.worldcat.org/oclc/28773463"">28773463</a>","1836-1960, Bangor, Bradley, Brewer, Old Town, Orono, Maine",,,,,,,,,,,308,"Waterville, Maine",Self-published,,,,,"<div class=""element-text""><a href=""http://books.google.com/books?id=mmelHAAACAAJ&amp;dq=chenard,+marriages+of+st.+joseph%27s+catholic+church,+old+town,+me&amp;hl=en&amp;ei=FU8iTKuEBsL-8Ab4hcydDg&amp;sa=X&amp;oi=book_result&amp;ct=result&amp;resnum=1&amp;ved=0CDAQ6AEwAA"">Marriages of St. Joseph's Catholic Church, Old Town, Maine @ Google Books</a></div>",,,,,,Acculturation and Assimilation;Bangor ME;Bradley ME;Brewer ME;Genealogy;Language and Linguistics;Old Town ME;Orono ME;Religion,Genealogy | Généalogie
"Mariages de Sainte-Rosaire de Rochester, NH, 1883-1976","Un répertoire (des noms familles) des mariages performé  dans la paroisse catholique de Sainte-Rosaire de Rochester, New Hampshire. Un de beaucoup de livres généalogiques franco-américains écrits par Croteau.","Croteau, Fr. Fernand",,,1977,,,,,,Genealogy,"<a href=""http://www.worldcat.org/oclc/402485530"">402485530</a>","1883-1976, Rochester, New Hampshire",,,,,,,,,,,155,,Self-published,,,,,"<div class=""element-text""><a href=""http://www.acgs.org/research/online-catalog.html"">http://www.acgs.org/research/online-catalog.html</a><br/><br/><a href=""http://books.google.com/books?id=3Iw0QwAACAAJ&amp;dq=Mariages+de+Sainte-Rosaire+de+Rochester,+NH,+1883-1976&amp;hl=en&amp;ei=1FRlTOfvNMP98AbwmuHMCA&amp;sa=X&amp;oi=book_result&amp;ct=result&amp;resnum=1&amp;ved=0CCsQ6AEwAA"">Mariages de Sainte Rosaire de Rochester... @ Google Books</a></div>",,,,,,Family;Genealogy;Religion;Rochester NH,Genealogy | Généalogie
"Madawaska, Maine: Family Reunion Trees","A chronicling of the living monuments planted in honor of local families in Madawaska, Maine, during the town's annual Acadian Festival and Family Reunion celebrations. Beginning in 1980, a tree was planted and a stone engraved each year in commemoration of the persistence of a different Acadian or French-Canadian family descended from Madawaska's original settlers.","DeFarges, Rachelle Chasse;Chasse, E. David;Chasse, Andrew W.;Chasse, Geraldine",,,2003,,,,,,Genealogy,,"1980-2003, Madawaska, Maine",,,,,,,,,,,68,"Madawaska, Maine",Madawaska Historical Society,,,,,"<div class=""element-text""><a href=""http://www.madawaskahistorical.org/"">http://www.madawaskahistorical.org/</a></div>",,,,,,Acadians;Community: Customs and Social Life;Family;Genealogy;Madawaska ME;New Brunswick;Nova Scotia;Québec,Genealogy | Généalogie
"The French Canadians, 1600-1900: An Alphabetized Directory of the People, Places and Vital Dates","Genealogical directory of French-Canadian names and places useful for Franco-American family, genealogical, or historical research as far back as the 17th century.","Elliot, Noel Montgomery",,,1992,,,,,,Genealogy,"<a href=""http://www.worldcat.org/oclc/25538822"">25538822</a>","1600-1900, Canada, United States",,,,,,,,,,,,"Toronto, Ontario",Genealogical Research Library,,9.78092E+12,,,"<div class=""element-text""><a href=""http://books.google.com/books?id=1LKOPgAACAAJ&amp;dq=the+french+canadians,+1600-1900&amp;hl=en&amp;ei=KSsBTaiYBIW0lQeX0Zm-CA&amp;sa=X&amp;oi=book_result&amp;ct=result&amp;resnum=2&amp;ved=0CCwQ6AEwAQ"">The French Canadians, 1600-1900 @ Google Books</a></div>",,,,,,Canada;Genealogy;Geography;New Brunswick;Ontario;Québec,Genealogy | Généalogie
Genealogist's Handbook for Upper Saint John Valley Research,"A resource guide and short bibliography for budding genealogists. Includes a brief historical overview of emigration to the St. John Valley region in the context of the Acadian expulsion (1755), the American Revolution (1776), and the relocation of British loyalists following the Treaty of Paris (1783). From the text: ""The focus of this guide is on the individuals who settled in the Madawaska Settlement beginning with the blended Acadian/French-Canadian families who moved there in 1865.""","Findlen, George",,,2003,,,,,,Genealogy,"<a href=""http://www.worldcat.org/oclc/52871722"">52871722</a>","1755-2000, St. John River Valley, Maine",,,,,,,,,,,81,,Genealogical Publishing Company,,9.78081E+12,,,"<div class=""element-text""><a href=""http://www.upperstjohn.com"">http://www.upperstjohn.com</a> <br/> <br/> <a href=""http://books.google.com/books?id=uxMlcQZ3gTAC&amp;printsec=frontcover&amp;dq=findlen%3B+genealogist%27s+handbook&amp;hl=en&amp;ei=HmwiTICSJML68AaBg6zLBQ&amp;sa=X&amp;oi=book_result&amp;ct=result&amp;resnum=1&amp;ved=0CDEQ6AEwAA#v=onepage&amp;q&amp;f=false"">Genealogist's Handbook for Upper Saint John Valley Research @ Google Books</a> (limited preview available)</div>",,,,,,Allagash ME;Bibliography;Caswell ME;Cyr ME;Eagle Lake ME;Fort Kent ME;Frenchville ME;Genealogy;Grand Isle ME;Hamlin ME;Madawaska ME;New Canada ME;Sinclair ME;St. Agatha ME;St. Francis ME;St. John River Valley;Van Buren ME;Wallagrass ME,Genealogy | Généalogie
French Canadian Sources: A Guide for Genealogists,"From Ancestry Publishing: ""A six-year collaborative effort of members of the French Canadian/Acadian Genealogical Society, this book provides detailed explanations about the genealogical sources available to those seeking their French-Canadian ancestors.""","Geyh, Patricia Keeney;Soltis Banachowski, Joyce;Boyea, Linda;Sarasin Ustine, Patricia;Holt Bourbonais, Marilyn;Ploenske Labelle, Beverly",,Ancestry Publishing,2002,,,,,,Book,"<a href=""http://www.worldcat.org/oclc/49699352"">49699352</a>",,,,,,,,,,,,329,"Orem, Utah",,,9.78193E+12,,,"<div class=""element-text""><a href=""http://books.google.com/books?id=svJKKvIWfUcC&amp;printsec=frontcover#v=onepage&amp;q&amp;f=false"">French Canadian Sources... @ Google Books</a></div>",,,,,,Acadians;Brunswick ME;Farming and Agriculture;Forestry;France;Genealogy;La Beauce QC;Montréal QC;Nova Scotia;Ottawa ON;Pierre SD;Prince Edward Island;Québec;Toronto ON,Genealogy | Généalogie
"The Necrology of St. Peter and Paul's Cemetery, Lewiston, Maine","List of persons interred at St. Peter and Paul's Cemetery, Lewiston, Maine. Volumes 1 and 2 have names of persons interred between 1870 and 1976. Volume 3 contains names of those interred between 1977 and 1992.","Labonté, Youville",,Self-published,1977,,,,,,Book,"<a href=""http://www.worldcat.org/oclc/4808338"">4808338</a>",,,,,,,,,,,,,"Auburn, Maine",,,,,,"<div class=""element-text""><a href=""http://books.google.com/books?id=X7cRHAAACAAJ&amp;dq=%22necrology+of+st.+peter%22%3B+labonte&amp;hl=en&amp;ei=wegkTNLRA4L68Abv3fy9Dw&amp;sa=X&amp;oi=book_result&amp;ct=result&amp;resnum=1&amp;ved=0CDUQ6AEwAA"">The Necrology of St. Peter and Paul's Cemetery...@ Google Books</a></div>",,,,,,Auburn ME;Death and Disaster;Genealogy;Lewiston ME;Religion,Genealogy | Généalogie
"St. Jean-Baptiste, Lowell, MA, 1869-1910","Marriage index of all persons wedded in St. Jean-Baptiste Roman Catholic Church, Lowell, Massachusetts, in the period from 1869 to 1910. The text includes over 1,600 marriages. This parish was terminated on June 30, 1993.","Labonté, Youville",,Self-published,1995,,,,,,Book,"<a href=""http://www.worldcat.org/oclc/32286274"">32286274</a>",,,,,,,,,,,,146,"Auburn, Maine",,,,,,"<div class=""element-text""><a href=""http://ecommunity.uml.edu/francolowellma/baptiste.htm"">http://ecommunity.uml.edu/francolowellma/baptiste.htm</a> <br/> <br/> <a href=""http://books.google.com/books?id=-YZvGwAACAAJ&amp;dq=labonte%3B+st.+jean-baptiste+lowell&amp;hl=en&amp;ei=PVcjTOLuLsT48AaMxtSpBQ&amp;sa=X&amp;oi=book_result&amp;ct=result&amp;resnum=1&amp;ved=0CCgQ6AEwAA"">St. Jean-Baptiste, Lowell, MA...@ Google Books</a></div>",,,,,,Family;Genealogy;Lowell MA;Religion,Genealogy | Généalogie
The Acadian Miracle,Book on Acadian genealogy written by a former Louisiana state senator. Primarily a draft of his family tree.,"LeBlanc, Dudley J.",,Evangeline Publishing Company,1966,,,,,,Book,"<a href=""http://www.worldcat.org/oclc/1829658"">1829658</a>",,,,,,,,,,,,419,"Lafayette, Louisiana",,,,,,"<div class=""element-text""><a href=""http://books.google.com/books?id=FxiVGQAACAAJ&amp;dq=the+acadian+miracle&amp;cd=1"">The Acadian Miracle @ Google Books</a></div>",,,,,,Acadians;Death and Disaster;Genealogy;Louisiana;Nova Scotia;United States,Genealogy | Généalogie
"Franco-American Marriages of New Bedford, Massachusetts, 1865-1920","55 year marriage repertory from Franco-American parishes of New Bedford, Massachusetts. Updated version of Albert Ledoux's original 1977 edition.","Ledoux, Albert;Letourneau, Armand;Letourneau, Mary",,American-French Genealogical Society,1986,,,,,,Book,"<a href=""http://www.worldcat.org/oclc/18609884"">18609884</a>","1865-1920, New Bedford, Massachusetts",,,,,,,,,,,478,"Pawtucket, Rhode Island",,,,,,"<div class=""element-text""><a href=""http://books.google.com/books?id=KKwVAgAACAAJ&amp;dq=letourneau%3B+franco-american+marriages+of+new+bedford,+MA&amp;hl=en&amp;ei=w25YTLXZLtD_nQfC3bXICQ&amp;sa=X&amp;oi=book_result&amp;ct=result&amp;resnum=1&amp;ved=0CDQQ6AEwAA"">Franco-American Marriages of New Bedford...@ Google Books</a></div>",,,,,,Genealogy;New Bedford MA;Religion,Genealogy | Généalogie
Reference and Guide Book for the Genealogist: Prepared Especially for the Franco-Americans,"From the American French Genealogical Society: ""AFGS is pleased to offer you this very helpful resource book as a reference and guide book for the genealogist. It is an excellent book for both beginner and experienced researchers in the quest for genealogical information. Mr. Letourneau is a founding member of AFGS and this book offers you the benefit of his many years of research experience. Mr. Letourneau has done a complete review of how to read the various repertoires that you encounter, including Jette, PRDH, and Drouin. He has lists of counties in New England and the province of Quebec, abbreviations that you may encounter, Catholic Parishes of the province of Quebec and New England listed by name and city.  Latin terms and what they mean, and lists of names written in Latin, French and English to help you when you are looking through primary source materials. He has included sections on various types of charts, on Genealogy Societies in the U.S., Canada and France, family associations and repositories and archives in the United States....In short, he has made a handbook that is sure to offer something for everyone who is researching a family name.""","Letourneau, Armand;Burkhart, Janice;Boudreau, Dennis;Pommeville, William",,American-French Genealogical Society,2003,,,,,,Book,"<a href=""http://www.worldcat.org/oclc/52628325"">52628325</a>",,,,,,,,,,,,378,"Woonsocket, Rhode Island",,,9.78193E+12,,,"<div class=""element-text""><a href=""http://www.afgs.org/refguide.html"">http://www.afgs.org/refguide.html</a> <br/> <br/> <a href=""http://books.google.com/books?id=cNdzPQAACAAJ&amp;dq=reference+and+guide+book+for+the+genealogist&amp;hl=en&amp;ei=PHGsTOLMMoyssAOM9NSFBA&amp;sa=X&amp;oi=book_result&amp;ct=result&amp;resnum=1&amp;sqi=2&amp;ved=0CDUQ6AEwAA"">Reference and Guide Book for the Genealogist...@ Google Books</a></div>",,,,,,Demography;France;Genealogy;Geography;Language and Linguistics;New Brunswick;New England;New York;Newfoundland;Nova Scotia;Ontario;Québec;Religion,Genealogy | Généalogie
Souches et racines : une introduction aè la généalogie pour les jeunes Franco-Américains,Un guide généalogique conçu pour les jeunes franco-américain(e)s et canadien(ne)s francais. Avec des ressources d'étudier les arbres de famille dans la region de la Nouvelle-Angleterre.,"Olivier, Julien",,National Materials Development Center,1981,,,,,,Book,"<a href=""http://www.worldcat.org/oclc/8528445"">8528445</a>",,,,,,,,,,,,175,,,,,,,"<div class=""element-text""><a href=""http://books.google.com/books?id=YZuWPAAACAAJ&amp;dq=souches+et+racines&amp;hl=en&amp;ei=aAlOTN3tBIG88ga33IGaDA&amp;sa=X&amp;oi=book_result&amp;ct=result&amp;resnum=1&amp;ved=0CCgQ6AEwAA"">Souches et racines...@ Google Books</a></div>",,,,,,Acadians;Boston MA;Genealogy;Lewiston ME;Nova Scotia;Youth,Genealogy | Généalogie
L'Acadie de mes ancêtres: histoire et généalogie avec cartes et illustrations (Beloved Acadia of My Ancestors: History and Genealogy),,"Léger, Yvon",,Fleuve,1992,,Français (English translation available),,,,Book,,,,,,,,Français (English translation available),,,,,409,"Montréal, Québec",Fleuve,,9.78289E+12,,,"<div class=""element-text"">http://www.acadian-roots.com/book-corner-three.html</div>",,Beloved Acadia of my Ancestors,,,,Acadians;Emigration and Immigration;Family;France;Genealogy;Louisiana;New Brunswick;Nova Scotia;Québec,Genealogy | Généalogie
"Rivieres, chemins, et sentiers",,"Chenard, Robert",,Le FAROG Forum,1991,,English,,,,Book,,,,,,,,English,,,,,38,"Waterville, Maine",Le FAROG Forum,,,,,"<div class=""element-text"">http://www.royandboucher.com/genealogy/showsource.php?sourceID=S471&amp;tree=T0001</div>",,"Rivieres, chemins, et sentiers",,,,Emigration and Immigration;Genealogy;Waterville ME,Genealogy | Généalogie
Proving the Parentage of John Bettis: Immigrant Ancestor of Bettis Families in Vermont,"Genealogical piece from the quarterly publication of the National Genealogical Society. Focuses on the Bettis, Perrin, and Vaillancourt families between the geographies of Canada and Vermont.","Ouimette, David S. ",,,2010 September,,English,,,,Journal Article,"<a href=""http://www.worldcat.org/oclc/1759226"">1759226</a>;<a href=""http://catalog.vermonthistory.org"">929 N21 v. 98</a>","21st century, Vermont",,,,,,,,,,,,,,0027-934X,,3,National Genealogical Society Quarterly,"<div class=""element-text""><a href=""http://www.ngsgenealogy.org/cs/ngsq"">http://www.ngsgenealogy.org/cs/ngsq</a></div>",98,,,,https://francolibrary.com/archive/files/00f7aadf9835563ef801496ff1d7cf3d.gif,Family;Genealogy;Québec;Vermont,Genealogy | Généalogie
Bringing a Photograph to Life: The Story of Joseph L. Miner,Article from the New England Historic Genealogical Society periodical. Genealogical research sparked from an interest in a picture displayed in the author's grandmother's Vermont home.,"Myrback, Margrit",,,2010 Fall,,English,,,,Journal Article,"<a href=""http://www.worldcat.org/oclc/517962020"">517962020</a>;<a href=""http://catalog.vermonthistory.org""> 929.05 bN44a</a>","20th and 21st centuries, Vermont",,,,,,,,,,,,,,2154-6533,,4,American Ancestors,"<div class=""element-text""><a href=""http://www.americanancestors.org/search.aspx?Re=myrback&amp;Run=1"">http://www.americanancestors.org/search.aspx?Re=myrback&amp;Run=1</a><br/><br/> <a href=""http://www.americanancestors.org/PageDetail.aspx?recordId=137332038"">http://www.americanancestors.org/PageDetail.aspx?recordId=137332038</a></div>",11,,,,https://francolibrary.com/archive/files/9441e960c1f929c50aa13dc9374b4576.jpg,Emigration and Immigration;Family;France;Genealogy;New England;Québec;Vergennes VT,Genealogy | Généalogie
"Dictionnaire national des Canadiens français, 1608-1760","Un livre qui contient des infos sur mariages et naissances canadiens français entre 1608 et 1760. Avec des surnoms. Un ressource important pour la généalogiste. Souvent dit ""the red Drouin books.""",American French Genealogical Society,,American French Genealogical Society,2003,,Français,,,,Book,"<a href=""http://www.worldcat.org/oclc/53920272"">53920272</a>","1608-1760, Québec",,,,,,,,,,,,"Woonsocket, Rhode Island",,,9.78193E+12,,,"<div class=""element-text""><a href=""http://books.google.com/books?id=I6RtQgAACAAJ&amp;dq=Dictionnaire+national+des+Canadiens+franc%CC%A7ais,+1608-1760.+2003&amp;hl=en&amp;ei=iJRaTaLvK4GC8gbDv6isDg&amp;sa=X&amp;oi=book_result&amp;ct=result&amp;resnum=4&amp;ved=0CDcQ6AEwAw"">Dictionnaire national des Canadiens francÌ§ais sur Google Books</a> <br/><br/> <a href=""http://www.ancestry.com/learn/library/article.aspx?article=2269"">http://www.ancestry.com/learn/library/article.aspx?article=2269</a></div>",,,,,,Canada;Family;Genealogy;Québec;Religion;Woonsocket RI;Youth,Genealogy | Généalogie
"The ""Dit"" Name : French-Canadian Surnames, Aliases, Adulterations, and Anglicizations","American exploration of the transition and development of French Canadian surnames in the United States, with a particular emphasis on those names now found in various forms in the New England states. The term ""dit,"" translated as ""called"" or ""a.k.a.,"" refers to the disconnect between one's spoken name and one's actual given name or family surname. Originally published in 1993 under the shortened title, ""French-Canadian surnames, aliases, adulterations, and anglicizations.""","Quintin, Robert",,Quintin Publications,1998,,English and français,,,,Book,"<a href=""http://www.worldcat.org/oclc/40965450"">40965450</a>","20th century, New England",,,,,,,,,,,171,"Pawtucket, Rhode Island",Quintin Publications,,,,,"<div class=""element-text""><a href=""http://www.quintinpublications.com/mm5m/merchant.mvc?Screen=PROD&amp;Product_Code=09303&amp;Store_Code=QP&amp;search=the+%22dit%22+name&amp;offset=&amp;filter_cat=&amp;PowerSearch_Begin_Only=&amp;sort=&amp;range_low=&amp;range_high="">The ""Dit"" Name... @ Quintin Publications</a> <br/><br/> <a href=""http://www.quintinpublications.com/category/RobertQuintinAuthors"">Robert Quintin @ Quintin Publications</a> <br/><br/> <a href=""http://books.google.com/books?id=Kr38YQEACAAJ&amp;dq=The+%22dit%22+name+:+French-Canadian+surnames,+aliases,+adulterations,+and+anglicizations&amp;hl=en&amp;ei=aEhdTcG0IIT7lwfv2KStCw&amp;sa=X&amp;oi=book_result&amp;ct=result&amp;resnum=1&amp;ved=0CDEQ6AEwAA"">The ""Dit"" Name... @ Google Books</a></div>",,,,,,Acculturation and Assimilation;Canada;Family;Genealogy;Language and Linguistics;New England;Québec,Genealogy | Généalogie
Our French Canadian Forefathers,"Genealogical sketch of a number of French and French Canadian families. Contains information on the following family lines, in the following order: Pontonnier, Gadois, Martin, Besnard, Langlois, Gouin, Baudouin, Perche, Choret, Crevier, Rondeau, Guillet, Chateauneuf, Couture. The link below is to an online publication of the chapter dedicated to the Crevier family.","Rock, Lucille Fournier",,Self-published,1982,,English,,,,Book,"<a href=""http://www.worldcat.org/oclc/9381945"">9381945</a>","16th century - 20th century, Canada, France",,,,,,,,,,,164,"Woonsocket, Rhode Island",Self-published,,,,,"<div class=""element-text""><a href=""http://www.family.crevier.org/download/free/FrenchCanadianForefathers.pdf"">http://www.family.crevier.org/download/free/FrenchCanadianForefathers.pdf</a> <br/><br/> <a href=""http://books.google.com/books?id=_JjcQgAACAAJ&amp;dq=rock;+our+french+canadian+forefathers&amp;hl=en&amp;ei=L9ZaTb6IEcX_lgeJwMT4DA&amp;sa=X&amp;oi=book_result&amp;ct=result&amp;resnum=1&amp;ved=0CDgQ6AEwAA"">Our French Canadian Forefathers @ Google Books</a></div>",,,,,https://francolibrary.com/archive/files/892d2422d659f99ed872e0a844a32b98.JPG,Canada;Family;France;Genealogy;Québec,Genealogy | Généalogie
